7/19/2023 10:22,7/19/2023 10:39,0,100,992,1,7/19/2023 10:39,R_0vmeVG54BgVgCDD,anonymous,EN,Stock 3 of 5:,2,"The stock looks to be in a strong uptrend, so it's possible that it may continue further to the upside.",,,20,,,,,,,,,,,,,,,,,,,,,,,,,,,,,,,,,,,,,,,,,,,,,,,,,,,,,,,,,,,,,,,,,Stock 2 of 5:,3,"It appears to have broken out into an upwards trend, so I'm expecting that it may continue further upwards.",,,20,,,,,,,,,Stock 1 of 5:,4,"It appears to have been in a sideways trend. So after the recent drop, it may recover back towards the sideways channel.",,,25,,,,,,,,,Stock 4 of 5:,3,"The stock appears to be in a slight uptrend, so it's possible that it may continue slightly higher over the next 10 weeks.",,,18,,,,,,,,,Stock 5 of 5:,3,"The stock appears to have paused and pulled back after a strong uptrend, so it's possible that it will resume the uptrend over the next 10 weeks.",,,20,,,,,,,,,,,,,,,,,,,,,,,,Maybe use our answers to see if other participants will change their minds or stick to their own predictions.,2,5e380457679e67000c56b02f,ThinkMore,ItemConfidence
7/19/2023 10:26,7/19/2023 10:39,0,100,797,1,7/19/2023 10:39,R_1mRh1uYiIkwAq9V,anonymous,EN,Stock 4 of 5:,2,"The stock has been skyrocketing in the past 5 weeks, but based on the previous weeks we might expect the slope to settle quickly",,,,26,36,22,10,3,1,1,1,Stock 2 of 5:,3,"The plot shows a steady climb over many weeks, so it feels save to assume it will keep that same trajectory for at least the near future",,,,9,21,59,4,3,2,1,1,,,,,,,,,,,,,,,Stock 3 of 5:,4,"The plot is steady at around D and E, so it will likely be one of the two. The past two weeks have been in D, so it's slightly safer to assume it will stay in that range.",,,,1,2,8,38,43,5,2,1,Stock 1 of 5:,4,"Judging by the shape of the plot, I suspect the stock will oscillate up and down, and will begin to climb after the last point ",,,,2,4,12,34,29,12,5,2,Stock 5 of 5:,5,"The plot is quite stable without any sharp changes, we can assume it will keep oscillating similarly",,,,1,4,16,30,34,12,2,1,,,,,,,,,,,,,,,,,,,,,,,,,,,,,,,,,,,,,,,,,,,,,,,,,,,,,,,,,,How easily the average joe can predict stock prices,1,648869966a219410707e2485,ThinkMore,Histogram
7/19/2023 10:27,7/19/2023 10:39,0,100,709,1,7/19/2023 10:39,R_3Dh65Hem55RjjbP,anonymous,EN,Stock 5 of 5:,1,I believe that this stock will reach a solid A price. There's a very high raise during this week with only minor reductions that always return to higher prices afterwards.,,,,53,22,15,6,4,0,0,0,Stock 3 of 5:,2,I think this specific stock will reach close to A but will only reach B. That is because the graph depicts a stable growth of the price of this stock throughout the week with only minor reductions.,,,,21,51,9,11,8,0,0,0,Stock 1 of 5:,7,It seems like this stock is going downhills and is not showing any indication to rise again. It could also remain stable for some period of time,,,,4,8,7,21,23,9,28,0,,,,,,,,,,,,,,,,,,,,,,,,,,,,,,,,,,,,,,,,,,,Stock 4 of 5:,4,"I can say that this one will reach back at its initial price on D. Even though there's a minor reduction at the end of the week, generally speaking the price seems to be almost stable and I predict that the price tends to go back to where it was.",,,,2,9,20,57,6,6,0,0,,,,,,,,,,,,,,,Stock 2 of 5:,3,"I would tell that it could be between B and C. It is safer to predict that it will land on C since there's some downhills during the week shown. Thus, I believe it would be closer to C than B.",,,,4,6,72,18,0,0,0,0,,,,,,,,,,,,,,,I really had fun.,Whether a graph may influence one's will to invest on some stocks or not.,3,60ca1c436511b9fc8ab35615,ThinkMore,Histogram
7/19/2023 10:23,7/19/2023 10:40,0,100,1035,1,7/19/2023 10:40,R_3MuGj0zgPwwIbtp,anonymous,EN,,,,,,,,,,,,,,,,,,,,,,,,,,,,,,,,,,,,,,,,,,,Stock 5 of 5:,5,I predict it would hit bin E as the pricing seems consistently on the areas between 90 and 100 and therefore bin e would be its most likely outcome ,,,75,,,,,,,,,Stock 2 of 5:,6,It will land in Bin F as the prices spike and then they started to dip down and were on the turn in the second half of the graph,,,10,,,,,,,,,Stock 3 of 5:,4,I believe it will land in Bin D because of the consistency rising in the second part of the graph at quite a steep curve,,,25,,,,,,,,,Stock 1 of 5:,5,The price will land in Bin E as it is the furthest along of the dots on the graph showing the range of pricing that were obtained ,,,8,,,,,,,,,,,,,,,,,,,,,,,,,,,,,,,,,,,,,Stock 4 of 5:,6,I believe it would land into Bin F as the cycle of pricing fluctuates up and down consistently and this is where it would land after the 10 week period,,,60,,,,,,,,,,,1,5a6b78840384310001945b47,ThinkMore,ItemConfidence
7/19/2023 10:23,7/19/2023 10:41,0,100,1090,1,7/19/2023 10:41,R_8wPEUeFhK5Ud53X,anonymous,EN,Stock 1 of 5:,3,"Company's stock looks pretty consistent to get value according to his last weeks, but i still don't think is that realistic to expect it to land on A or B, so i would go C conservately",,,,15,20,30,25,5,3,1,1,Stock 3 of 5:,3,"Stock's price has been increasing slowly but steady, i would expect to keep the same consistency, i guess the price will land on C",,,,2,17,50,22,4,3,1,1,,,,,,,,,,,,,,,,,,,,,,,,,,,,,,,,,,,,,,,,,,,Stock 4 of 5:,4,"Looks kinda unpredictable cause the price is recovering from a heavy drop, i think it's more safe to expect the price to land on D instead of keep growing.",,,,1,7,11,40,30,8,2,1,Stock 5 of 5:,6,"It's rare to see heavy drops on company's stock, so i would think they would try to regulate the price before reaching under 75% initial price, so i would expect to land on F",,,,1,3,4,9,16,30,24,13,,,,,,,,,,,,,,,Stock 2 of 5:,5,"Looks to be increasing pretty stable until the last 5 weeks, so i would expect the price to hit some kind of plateau now, i would choose E",,,,2,3,10,15,40,20,7,3,,,,,,,,,,,,,,,,,1,606dc21c1ce7dc64af9d81fb,ThinkMore,Histogram
7/19/2023 10:23,7/19/2023 10:42,0,100,1136,1,7/19/2023 10:42,R_1r7kllH0VSuC3f7,anonymous,EN,,,,,,,,,,,,,,,Stock 3 of 5:,4,"The price increased and decreased during the previous weeks, yet remained in bin D. I predict the price will remain stable during the coming weeks",,,80,,,,,,,,,,,,,,,,,,,,,,,,,,,,,,,,,,,,,Stock 5 of 5:,5,There was a decrease in the price during the previous weeks. I predict the price will remain in bin E,,,80,,,,,,,,,Stock 2 of 5:,4,"There was a steady increase in the price during the previous weeks. I, therefore, predict the increase will continue during the coming weeks",,,81,,,,,,,,,Stock 4 of 5:,6,There was a steady decrease in the price during the previous weeks. I predict the decrease in price will continue.,,,69,,,,,,,,,Stock 1 of 5:,4,"There were slight changes to the price in the previous weeks. Hence, I guess there will not be a major decrease in the price in the coming weeks.",,,80,,,,,,,,,,,,,,,,,,,,,,,,,,,,,,,,,,,,,,I think this study is about how we perceive fluctuations in the stock market,1,6161bdbff67e4b4621b530e7,ThinkMore,ItemConfidence
7/19/2023 10:23,7/19/2023 10:42,0,100,1119,1,7/19/2023 10:42,R_2U8UcyVxP5FRuW2,anonymous,EN,,,,,,,,,,,,,,,Stock 2 of 5:,3,"Although the price has been reasonably static according to results in D, there have been steady price rises so would expect this to continue over the coming 10 weeks.",,,70,,,,,,,,,Stock 5 of 5:,6,"This stock has fallen quite rapidly from the initial price, it does not look hopeful for the future.  Judging by this drop I would expect the price to fall a little further over the next 10 weeks.",,,60,,,,,,,,,Stock 1 of 5:,4,"The price has fallen in the most recent period and then remained static, I would expect the price to remain similar for a short period.",,,60,,,,,,,,,,,,,,,,,,,,,,,,,,,,,,,,,,,,,Stock 4 of 5:,6,This stock is falling quite rapidly after levelling out for a while in an earlier period.  The downward trend looks likely to continue.,,,70,,,,,,,,,,,,,,,,,,,,,,,Stock 3 of 5:,4,"After initial stock price rises, it appears that the rises have halted and dropped slightly in recent weeks.  I would imagine the price will recover but not move up to the higher band as yet.",,,75,,,,,,,,,,,,,,,,,,,,,,,"Interesting, thank you",Predictions and how to judge pricing.,1,597519f8262c480001bbaf8b,ThinkMore,ItemConfidence
7/19/2023 10:23,7/19/2023 10:42,0,100,1164,1,7/19/2023 10:42,R_u4e9IuZjvEEyIJX,anonymous,EN,Stock 4 of 5:,2,There is quite a nice trajectory going in an upwardly direction so I would expect the next spot would be B for the time period specified.,,,,23,29,21,15,8,2,1,1,Stock 1 of 5:,3,I am following the same trajectory as what has already happened so predict it will fall in C over the period of time mentioned.,,,,9,29,33,16,8,3,1,1,,,,,,,,,,,,,,,,,,,,,,,,,,,,,Stock 5 of 5:,6,There is a general pattern whereby I expect that the point will be F for the time period for which I have been asked to plot the point on the graph,,,,2,3,4,9,24,29,22,7,,,,,,,,,,,,,,,Stock 2 of 5:,7,"There is quite a lot of volatility and I expect that the low points most recently plotted will be hard to fully recover from in a short period of time, so think G is the most likely spot.",,,,1,5,8,12,17,20,24,13,,,,,,,,,,,,,,,Stock 3 of 5:,4,There is quite a lot of volatility but I expect that the point will follow in the range that is most established. D is therefore the most likely spot to pick.,,,,1,2,22,25,23,20,4,3,,,,,,,,,,,,,,,,,1,56a8bb427f2472000b9522f6,ThinkMore,Histogram
7/19/2023 10:23,7/19/2023 10:42,0,100,1186,1,7/19/2023 10:42,R_3oS1mtMUZrLhRzK,anonymous,EN,Stock 2 of 5:,4,,C that’s where most of the stocks closing will be seen based on the trend ,E is too low since the data is gradual when compared to the given data,,1,1,36,61,1,0,0,0,,,,,,,,,,,,,,,,,,,,,,,,,,,,,Stock 4 of 5:,3,,"B is too high for the price to land there, therefore most prices will be on C ",The points shown on D are already moving to next bin and there the graph is increasing not decreasing ,,1,1,58,31,6,3,0,0,Stock 3 of 5:,4,,C is can be possible based on the data but not solid ,The scatter plot plots needs to show an increase so E can’t be an option ,,1,1,30,47,16,2,2,1,,,,,,,,,,,,,,,,,,,,,,,,,,,,,Stock 1 of 5:,5,,D is the bin where the price is initially and looking at the trend of the scatter plot.  The price will go down over some time but not too low ,F is a possibility but it went too down as the data represented shows to be gradual ,,2,2,3,26,43,18,3,3,Stock 5 of 5:,5,,The data will take time to reach point C since the scatter is clustered in one place ,The is a high chance to have something in F since there is already eta present in pin E,,2,2,7,24,46,19,0,0,,,,,,,,,,,,,,,,,2,612e5e5ee3ea8f000c2aed0f,ThinkDifferent,Histogram
7/19/2023 10:23,7/19/2023 10:43,0,100,1203,1,7/19/2023 10:43,R_3Hq8j2M2TxvdGLL,anonymous,EN,,,,,,,,,,,,,,,,,,,,,,,,,,,,,,,,,,,,,,,,,,,Stock 3 of 5:,4,,The price of this stock shows a clear upward trend from 90 to 110. The price has rejected 110 temporarily but it is building a basis from which it will continue higher into bin c.,The factors responsible for the stock price increase from 90 to 110 have come and gone. The price tried to break above 110 but was rejected. It is likely that the price of the stock continues to trend lower and consolidates in bin e.,,3,12,18,24,22,11,7,3,,,,,,,,,,,,,,,Stock 4 of 5:,4,,The price has bounced off of the mid 80s range and is likely to continue higher with its current upward momentum and trajectory. If the trend continues it is likely the price will go into bin C.,"The price dropped into the mid 80s, bounced, and has now entered its previous range of 100. It is likely that the price of the stock may reject 100 again and decline into bin e.",,5,11,21,25,22,10,5,1,,,,,,,,,,,,,,,Stock 5 of 5:,4,,The price of this stock shows a strong upward trend and it bounced of 90 and has continued upwards without stalling. It is very likely the trend continues as it has held so far and the price ends in bin C,The price has stalled around 110. It is likely that the upwards trend in price has stalled and that a new regime of stability or decline may begin. This change in regime will be preceded by a small pullback which will bring the stock price into bin e,,6,10,20,24,21,10,6,3,Stock 1 of 5:,4,,The price has momentum to the upside (into bin C) as shown by its recent increase. It is likely that the price will consolidate before continuing to trend higher,The price has risen and momentum has begun to stall. It is likely that the price drops a little bit more and stabilizes in bin E as whatever had driven stock price up no longer matters.,,3,10,20,24,17,15,8,3,Stock 2 of 5:,4,,The price of the stock shows volatility and it seems whatever has caused the recent downtrend in price has subsided. It is likely that the price will increase slightly more before stabilizing in bin C.,The price of this stock is volatile but there is a clear downtrend in the average price. This trend is unlikely to be broken so the price will likely go into bin #.,,6,9,14,19,20,15,9,8,,How people try to convince themselves and others that they can predict future stock prices based on a price chart,4,5af107100eca060001b13ff2,ThinkDifferent,Histogram
7/19/2023 10:23,7/19/2023 10:43,0,100,1210,1,7/19/2023 10:43,R_QgggBfnDTbYSpOh,anonymous,EN,,,,,,,,,,,,,,,Stock 5 of 5:,2,,this stock shows strong pattern of growth so there is strong chance predicted price will reach section A,pattern shows that this stocks price have been rapidly growing but have started to slow down so I strongly believe future price will be in high sector C,,1,44,33,12,10,0,0,0,Stock 4 of 5:,6,,Even tho stock value is declining  it does go up and down so I believe stock price will remain in sector E,following pattern of strong declined I believe this stock value will continue to dip and end in section G,,0,0,0,0,17,51,32,0,,,,,,,,,,,,,,,Stock 2 of 5:,4,,looking at stock price pattern its seems to go up and down in very steady pattern due to that stock predicted price will end in section C,this stock seems to highly unstable and have started dipping since reaching top point so realistically predicted price will end in section E ,,1,1,9,47,35,5,1,1,Stock 1 of 5:,4,,looking at graph its visible that stock did dip however it been steadily growing every week since than following the same pattern  It is more than possible that the predicted stock price will land in sector C,this stock have visible value fluctuations and looking at past pattern and highest price its easy to see stock dipping again and predicted stock value ending in sector E,,1,4,10,42,11,29,1,2,,,,,,,,,,,,,,,,,,,,,,,,,,,,,,,,,,,,,,,,,,,Stock 3 of 5:,5,,this stock seems to mainly remain in section D and even with fluctuation in pattern its still lingers in section D that's where I predict Price will end up,there is strong pattern of decline in this stock value so following that I strongly believe stock price will end in Section F,,0,0,1,28,46,21,4,0,,different way of people presenting visual information to convince others of their predictions,2,59ba6e9162b30d0001b7acab,ThinkDifferent,Histogram
7/19/2023 10:23,7/19/2023 10:44,0,100,1222,1,7/19/2023 10:44,R_1CgAJJq2HFD6Wcb,anonymous,EN,,,,,,,,,,,,,,,Stock 2 of 5:,5,"I suspect that there will be a correction of increases, because in the analyzed period the exchange rate was still growing.",,,70,,,,,,,,,,,,,,,,,,,,,,,,,,,,,,,,,,,,,Stock 4 of 5:,3,"
The price was steadily growing, after a period of decline, stocks could be bought back and there is a chance for another attack on the tops.",,,60,,,,,,,,,Stock 1 of 5:,4,"The share price is very stable, the historical fluctuation range is quite small. For some time the situation looks optimistic, but I don't think that the increases will be strong.",,,65,,,,,,,,,Stock 3 of 5:,6,"The recent price declines have been dynamic, so there must be a serious problem. But the moment of panic seems to be over.",,,70,,,,,,,,,,,,,,,,,,,,,,,,,,,,,,,,,,,,,Stock 5 of 5:,5,"The price of this stock is quite unpredictable, although recently it has been more stable. I think that many investors can use this to ""escape"" and the price will go down a bit.",,,70,,,,,,,,,,"The project could study the risk appetite of stock market investors, the ability to persuade.",3,5bafd12a70f8df0001be84a7,ThinkMore,ItemConfidence
7/19/2023 10:23,7/19/2023 10:44,0,100,1276,1,7/19/2023 10:44,R_2QRihkCRhHy5NjL,anonymous,EN,,,,,,,,,,,,,,,,,,,,,,,,,,,,,,,,,,,,,,,,,,,Stock 3 of 5:,6,"F is the bin in which the final price will most likely land, because by looking at the dot lines, there seems to be a resistance. The price is unlikely to go up but down",,,68,,,,,,,,,Stock 4 of 5:,5,E is the bin the final price will most likely land because therr seems to be a zig zag pattern going on. The price will most likely end where it started.,,,80,,,,,,,,,,,,,,,,,,,,,,,Stock 2 of 5:,4,"The final place will most likely end into bin D, beacuse that seems to be the resting point of the price.",,,50,,,,,,,,,Stock 5 of 5:,2,B because the price is showing a slow gradual increase with no signs of decrease. The price will keep on increasing.,,,92,,,,,,,,,Stock 1 of 5:,3,The price will likely land to C because the price is showing no sign of declining. It will just retest then rise again.,,,81,,,,,,,,,,,,,,,,,,,,,,,Interesting study!,If we can make the right predictions based on our point of view of the dots ,3,611e2078cadc8161a119af67,ThinkMore,ItemConfidence
7/19/2023 10:23,7/19/2023 10:45,0,100,1316,1,7/19/2023 10:45,R_z7keD2rY3CGftVn,anonymous,EN,Stock 4 of 5:,3,,"this stock experienced a challenging 85% drop, but it made an astounding recovery, surging by 145%!",Such resilience indicates the company's ability to adapt and flourish despite setbacks,97,,,,,,,,,Stock 1 of 5:,3,,"I am writing to share an incredible investment opportunity that I believe you shouldn't miss out on.a dynamic and innovative firm, is currently on an upward trajectory, and I am convinced that their stock is poised for significant growth.","Over the past 10 weeks, this company's stock has witnessed an impressive surge, creating an opportunity worth considering. With their recent upward momentum, there's a possibility that they may maintain or even exceed these positive numbers in the future. This is a chance to potentially ride the wave of success and secure promising returns. Dive into the research, and let's explore the potential together",91,,,,,,,,,Stock 2 of 5:,6,,Careful research and analysis can reveal if this is the chance to invest low and reap higher rewards when the stock rebounds. Let's explore this potential,"Despite a recent 30% dip over the last 10 weeks, this company's stock presents an intriguing opportunity. Market fluctuations are common, and this decline could be an ideal entry point. ",98,,,,,,,,,,,,,,,,,,,,,,,,,,,,,,,,,,,,,Stock 5 of 5:,4,,"This stock encountered an 85% downturn but bounced back remarkably, regaining 103% in just 10 weeks.",The company's ability to rise from adversity showcases its resilience and determination. Now is the time to explore if this upward momentum will continue.,62,,,,,,,,,,,,,,,,,,,,,,,,,,,,,,,,,,,,,,,,,,,,,,,,,,,Stock 3 of 5:,4,,"Thrilling rollercoaster ride! This stock surged 105%, then dipped to 75, and now stabilizes at 96. Despite the ups and downs, it demonstrates resilience and potential for growth. ","Timing is key in the market, and at 96, it might be a strategic entry point for a potentially rewarding journey.",75,,,,,,,,,,"Financial markets are inherently volatile, influenced by numerous factors such as economic data, geopolitical events, and even public sentiment.",2,5f06595e1814f21b3e4ab084,ThinkDifferent,ItemConfidence
7/19/2023 10:23,7/19/2023 10:45,0,100,1331,1,7/19/2023 10:45,R_tRN0LXgufHxP1vz,anonymous,EN,,,,,,,,,,,,,,,Stock 1 of 5:,1,The stock is continuing to make higher highs i.e. closing price on average is going up. Price is also being offered equally to sellers and buyers which is shown by the pullbacks in price. S&P 500 is also known to give good value over a period of time.,,,95,,,,,,,,,,,,,,,,,,,,,,,,,,,,,,,,,,,,,Stock 3 of 5:,6,Price looks like it has been trending lower. There is a high possibility that this trend will continue. However there might be a bit of a pullback into higher price levels then drop.,,,70,,,,,,,,,Stock 2 of 5:,3,Price is almost going to make a new weekly high. Price should then pullback due to the resistance at 100 (which is a psychological number) Then make its way higher.,,,90,,,,,,,,,Stock 5 of 5:,6,Price left a fair value gap between the 95 and 85 level. Price was not offered equally to sellers and buyers. Price should trade and fill that gap before going lower thus should land in block F. The overall trend is a downtrend thus we can assume the trend will continue/there is a high probability that it will continue. Price also moves/trades in steps and doesn't just go lower.,,,95,,,,,,,,,,,,,,,,,,,,,,,,,,,,,,,,,,,,,Stock 4 of 5:,4,"Using technical analysis and smart money concepts. Price will most probably retest the 85 level as there is a fair value gap i.e. price moved too quickly on that level and was not offered fairly to buyers and sellers. Once level has been retested, Price should then go up and land between 95 and 105. S&P 500 is known for value of a longer period thus that sentiment suggests that price will continue higher but first must retest the 85 level as there's buy stop orders resting there.",,,95,,,,,,,,,N/A,Perhaps seeing if one can predict the future of a stock using past data of the same stock.,3,5c41f9ce4fe4f800016dfaac,ThinkMore,ItemConfidence
7/19/2023 10:23,7/19/2023 10:45,0,100,1311,1,7/19/2023 10:45,R_25ZRDd4UQ2mIbJH,anonymous,EN,,,,,,,,,,,,,,,,,,,,,,,,,,,,,Stock 5 of 5:,6,,Could be that the fall is over and the price is starting to pick up again.,"It really seems like there is no future for this stock, the drop is huge and people are selling.",,0,0,0,0,0,40,40,20,Stock 4 of 5:,3,,"The stock is definitely picking up again since the plateau, looking at the chart, it seems to rise by at least $20.",The stock is definitely picking up again since the plateau.,,15,20,45,20,0,0,0,0,Stock 2 of 5:,2,,"The price had reached its high point and people started selling, could be that the trend is picking up again and people are starting to buy.","The price had reached its high point and people started selling, could be a long time before it's going to pick up again.",,0,15,30,0,0,30,25,0,Stock 1 of 5:,4,,"Considering that the price has not been higher than 100, it seems like the trend is moving upwards for people to make a quick buck. I recommend this trade.","Considering that the price has not been higher than 100, the chart's struggling to get there, people are eager to sell their stocks. I would recommend selling.",,12,25,50,13,0,0,0,0,,,,,,,,,,,,,,,,,,,,,,,,,,,,,Stock 3 of 5:,6,,The upwards movement has definitely plateaued and people are starting to sell.,"It seems like we're going below $90 as the upwards movement has plateaued, people are taking their profits.",,0,0,0,0,0,45,55,0,,,,,,,,,,,,,,,,,3,60553b36cb4eb3269931ed21,ThinkDifferent,Histogram
7/19/2023 10:23,7/19/2023 10:45,0,100,1342,1,7/19/2023 10:45,R_eLk600je0nPmvqp,anonymous,EN,Stock 1 of 5:,4,,"After gaining value so quickly, it's very possible that the stock stabilizes around the new value.","Sometimes when a stock goes up so quickly, it immediately goes down. It doesn't mean it's going to decrease until the previous value, but volatility tends to go both ways",,17,19,21,17,9,7,5,5,Stock 3 of 5:,5,,It's possible that the stock stabilizes around the new price for awhile,"Sometimes when s stock goes up, it goes down the same way, usually the trajectory of up but it could perfectly go both ways",,9,11,17,22,17,10,9,5,Stock 4 of 5:,5,,"Sometimes when the stock finds what appears to be a support zone, it goes temporally up, and then it could go either way","The trajectory of the stock is down, it's normal to think that is going to do so for awhile, depending on the situation",,3,6,7,15,21,21,17,10,,,,,,,,,,,,,,,,,,,,,,,,,,,,,,,,,,,,,,,,,,,,,,,,,,,,,,,,,Stock 2 of 5:,4,,"The stock seems to be going up slowly but surely, it could be a possibility to continue to gain value and momentum","Although the trend of the stock is up, it's possible that it goes down a bit to later continue it's current trajectory up",,9,11,19,21,19,11,6,4,,,,,,,,,,,,,,,Stock 5 of 5:,5,,"It could be in either direction really, without more information is difficult to say, maybe stabilizes around the new value for awhile","It could be in either direction really, without more information is difficult to say, maybe it goes down again following the current pattern ",,6,10,15,22,17,14,10,6,,"How people try to predict the stock market with biases around previous values, but it usually it doesn't work, because previous values are irrelevant to future prices",2,5bf9dae56ecc0c00017ce46e,ThinkDifferent,Histogram
