7/19/2023 10:23,7/19/2023 10:50,0,100,1620,1,7/19/2023 10:50,R_3rGRYOBt2skx9Ke,anonymous,EN,Stock 1 of 5:,5,,These prices have been rising consistently and I dont think they've peaked yet. It might be worth the risk to buy now.,I think the price has peaked on this and they will drop nearer to 110 - 115p when you'll be able to buy at a better rate then watch them soar.,,2,4,6,26,46,9,4,3,Stock 2 of 5:,3,,I think these prices are still looking good as I expect them to rise much higher based on the traditional prices. There have been a few anomalies but I think things are starting to move up.,The groupings are mostly around the 125-135p but I think looking at the history they will drop slightly before bouncing back.,,0,0,40,24,23,12,1,0,,,,,,,,,,,,,,,Stock 4 of 5:,4,,"The prices have fluctuated in your favour, now is a great time to buy.","Bit concerned about the market, I think the price will fall a little before an upturn, could be a good time for you to buy. ",,0,0,9,40,38,13,0,0,Stock 3 of 5:,5,,"We are just seeing a small dip before prices jump again to above 110p, I cant see any great change, just a gentle climb.","These are passed their best, I predict a drop in price so hold off.",,1,4,5,21,25,28,12,4,,,,,,,,,,,,,,,,,,,,,,,,,,,,,Stock 5 of 5:,4,,"This is consistently improving. Shares will rise, now is time to buy..","There is uncertainty I  the market, the prices will drop  be ready to pounce when they drop.",,0,0,25,52,23,0,0,0,,,,,,,,,,,,,,,,,,,,,,,,,,,,,,,1,63b31b2fe1146395db2d0fd7 ,ThinkDifferent,Histogram
7/19/2023 10:23,7/19/2023 10:51,0,100,1667,1,7/19/2023 10:51,R_3F4Bv9pA88t1S6I,anonymous,EN,,,,,,,,,,,,,,,,,,,,,,,,,,,,,,,,,,,,,,,,,,,Stock 5 of 5:,4,worst case scenario its can go down but i think its will remain  on d looking at the pattern of the graph   ,,,51,,,,,,,,,Stock 1 of 5:,5,"i looked at the others on how the weeks ended and saw that its was on E for the past 8 weeks and i don't know if there is anything that can shake the market right now to make it go up or down, that is why i chose it will remain on E",,,50,,,,,,,,,,,,,,,,,,,,,,,Stock 3 of 5:,6,the stock price has been going down a lot and I don't think its will change drastically that is why i see it giong down rather than going up or staying in the same bin ,,,50,,,,,,,,,,,,,,,,,,,,,,,Stock 2 of 5:,4,The stock price seemed to be unstable but its goes up mostly but i think even if its goes down its wont go lower to E that is why i am thinking its will stay on D,,,40,,,,,,,,,Stock 4 of 5:,5,its  seems like its curving down its could stay on d but i chose E its just my prediction looking at the previous week on how the graph went each week  ,,,61,,,,,,,,,,seeing if people understand stock market ,1,5fa879d9f68b9371d90c3aa3,ThinkMore,ItemConfidence
7/19/2023 10:23,7/19/2023 10:51,0,100,1708,1,7/19/2023 10:51,R_2YWIlU8ofvMxeuB,anonymous,EN,,,,,,,,,,,,,,,Stock 4 of 5:,3,"The stock has a strong upwards tend in long timeframe, despite quite a lot of daily 'chop.' Therefore, if we ignore the chop and continue this strong trend towards the right of the graph, then it looks like the 10th point is likely to fall within section C.",,,,0,27,45,28,0,0,0,0,Stock 2 of 5:,6,"This stock is showing a strong downtrend, which is likely due to external circumstances of which we are not aware. Therefore, I judge this downtrend will continue, and I estimated the length that 10 datapoints occupies on the x-axis, and extrapolated that same distance towards the right of the graph. If the stock continues to decline at the same rate, for another 10 weeks, then the final data point of that set should fall around the bottom of section F.",,,,0,0,0,3,16,53,28,0,,,,,,,,,,,,,,,Stock 1 of 5:,4,"Stocks tend to trend upwards over longer time frames, crashes notwithstanding, and so I guess that this stock has likely reached the bottom of a downturn. I therefore counted backwards for 10 data points to judge the length of the x-axis for that time frame, and projected that same length forward (rightwards), and this would give us a data point likely to fall in D.",,,,6,8,12,54,17,3,0,0,,,,,,,,,,,,,,,,,,,,,,,,,,,,,,,,,,,,,,,,,,,Stock 3 of 5:,3,"This stock has had a minor setback in the previous 6 weeks, but the market has rejected the price drop as being oversold, and the stock seems to be therefore recovering towards the trend line at the left of the graph. If we carry on this trendline, and add on 10 imaginary data points, I judge the final one of those points will fall within section C.",,,,0,14,48,27,11,0,0,0,Stock 5 of 5:,5,"This stock has a clear regular 'waveform', as well as a downward trend. I think it is showing signs of beginning the downward part of the waveform, as well as to continuing the log-term downward trend, therefore the final data point is likely to fall in section E.",,,,0,0,5,24,40,31,0,0,n/a,It maybe a study of the 'wisdom of crowds' in terms of the technical analysis of charts. ie the aggregate of a large number of guess may tend towards accuracy.,2,636d39168fe0bc0570ee8da0,ThinkMore,Histogram
7/19/2023 10:23,7/19/2023 10:51,0,100,1734,1,7/19/2023 10:51,R_3LZKTZLs6kgPibE,anonymous,EN,,,,,,,,,,,,,,,,,,,,,,,,,,,,,Stock 3 of 5:,6,,"Although the trend in recent times has been ""down"", there are also periods of ""rise"". Speaking in terms of probability, what would be expected would be a brief rise, so the price would easily find itself back in the ""E"" band, where it has been for the last time.","If we look at the general trend, this is ""negative"". The price has gone down, almost constantly, from the beginning, going from the ""B"" band to the ""E"". Considering this, it is a matter of time before the price collapses and ends up in the ""G"" band, despite the moments of stabilization.",,0,0,0,0,40,40,20,0,Stock 1 of 5:,4,,"For some time now, the share price has stabilized in the ""D"" range. Going further, peaks very close to ""C"" have been observed. Considering the general price trend, it is a matter of time before the price reaches the ""C"" range and stabilizes in it.","For some time now, the share price has stabilized in the ""D"" range. However, and seeing the most recent trend, the most likely thing is that it will return to ""E"", where it has been located for most of the time. In addition, over time there are different ""downward"" trends, so it is a matter of time before it ends in ""E"".",,0,10,20,50,20,0,0,0,,,,,,,,,,,,,,,Stock 2 of 5:,4,,"Looking at the general trend of the share price, we see that it will most likely continue to rise. It is a matter of time before the price ends in the ""D"" range and confirms this ""upward"" trend. In recent times, this increase can also be observed.","Although the price of the last dates tends to rise, a ""downward"" trend can also be observed, so considering a ""cyclical"" evolution, it would be expected that the price would fall, up to section ""E"", where most of the time has passed.",,0,0,10,20,60,10,0,0,,,,,,,,,,,,,,,Stock 4 of 5:,4,,"If we look at the general trend, we can see that the price tends to rise, progressively. Having stabilized for a time in ""D"", it is expected that it will soon reach the ""C"" range (and this trend will continue). Going further, no significant declines have been found.","If we look at the general trend, we see ""downside"" spikes that precede stabilization. Considering a time in the ""D"" band, it can be expected that it will drop to ""E"". In addition, if we look at previous times, we see that the price usually frequents the ""E"" - ""F"" bands, so a much higher price would not be expected, for example, reaching ""C"".",,0,0,20,60,20,0,0,0,Stock 5 of 5:,4,,"Taking into account the general trend of the share price, it tends to rise. This is seen in the incredible rise from its beginning, from ""G"" to ""D"". It is a matter of time before it ends in ""C"", especially after a brief ""downward"" period, which precedes stabilization.","While the general trend has been for the price to rise, we see a long stabilization time at ""D"", followed by a decline to ""E"". One would expect the price to not only stabilize, but to go down, recently being at ""E"" (even being at ""D"", it was closer to ""E""). Then, it's a matter of time before it goes down.",,0,0,10,80,10,0,0,0,,,,,,,,,,,,,,,,,2,6112cf0b9c1cf4219c5c2675,ThinkDifferent,Histogram
7/19/2023 10:23,7/19/2023 10:52,0,100,1732,1,7/19/2023 10:52,R_1rk11VbW5Tcva1B,anonymous,EN,Stock 1 of 5:,2,,"Do you see how much the price has been rising? That gradient is so steep, I don't see how it could possibly drop even a little bit. It's all up!","Do you see how much the price has been rising? That kind of growth isn't sustainable. We can't expect the price of the stock to keep going up, so this prediction is a safe bet. ",70,,,,,,,,,Stock 4 of 5:,3,,"When you consider the trajectory of the stock's price, it's gradient clearly shows itself moving towards the position of B, even considering the decreases.  ","The stock price has been repeatedly increasing and decreasing in quick succession, so by the time we reach 10 weeks, any increase from the previous week would've been undone by the increase, leading to box D.",63,,,,,,,,,Stock 3 of 5:,6,,"The stock price has been steadily decreasing, but given how it has previously increased as well, it's not unreasonable to believe that it can rise again after a decrease, putting it back at E. ","The price is dropping with a very steep gradient. If it continues to follow this trend, the trajectory shows it ending up at G.",55,,,,,,,,,,,,,,,,,,,,,,,,,,,,,,,,,,,,,,,,,,,,,,,,,,,,,,,,,,,,,,,,,Stock 5 of 5:,4,,"Making a mean gradient of the stock market prices, one could predict the price landing at C or D. Given how the most recent trend has been upward, we could reasonably predict it might be higher (i.e. C). ","The stock price has been increasing very slowly, with periods of decreases. Given this, a decrease is quite overdue and may occur soon, leading to the price settling at E. ",59,,,,,,,,,,,,,,,,,,,,,,,Stock 2 of 5:,5,,"This stock looks like it's beginning to even out a bit, given the trend. I predict it will make it to D using this trend. ","Given how the stock price has been increasing and decreasing fairly rhythmically, following that pattern, it would likely drop again and rise in time to end up in F.",63,,,,,,,,,,,3,600bfa88b135b82bdf3dcc36,ThinkDifferent,ItemConfidence
7/19/2023 10:22,7/19/2023 10:52,0,100,1763,1,7/19/2023 10:52,R_2D0wY9IYIHfZDL5,anonymous,EN,,,,,,,,,,,,,,,Stock 1 of 5:,2,I chose B because the points are going up steadily in that direction. If the price keeps on increasing at the same rate it will end up in section B as if you drew a line from the points in the same angle that's were it would end up. I believe with certainty that is the the stock price will be as long as it continues at the steady rate it has been continually been growing in. Also the stock price goes up and down consistently and if you imagine it doing that on the graph it would end in section B. ,,,75,,,,,,,,,,,,,,,,,,,,,,,,,,,,,,,,,,,,,Stock 4 of 5:,5,I believe that this stock will be in section E after the 10 weeks as that is where it has rested for the vast majority of the time on the graph. If you look at the points on the graph it has been in section E on 22 occasions and has remained in section E for the last 8 occasions. With this in mind I believe that it will continue following this trend and will likely end up in a similar spot.,,,70,,,,,,,,,,,,,,,,,,,,,,,Stock 2 of 5:,6,I believe that the stock price will end up in section F after 10 weeks. I believe that it would carry on dropping significantly for a while and then will start trending towards the cheapest it has been. I think it will trend upwards again as it has consistently been around that price and I think it will bounce back towards the E section but after that amount of time will have only reached F on it's upward trend. I think it will keep dropping within the 10 weeks and make its way back to this point within that time.,,,41,,,,,,,,,Stock 5 of 5:,3,As this stock as been on a steady incline for a while I believe that it will end up in section C. If you draw a line in the direction that the points are trending you could see that it will end up in section c. I also believe this with lots of certainty as the stock has rarely decreased in value and has only decreased very slightly when it has not affecting the overall upwards trajectory. ,,,80,,,,,,,,,,,,,,,,,,,,,,,Stock 3 of 5:,5,"I think the stock will end up in section E. The reason I think this is because from looking at the history of the stock it fluctuates up and down quite regularly. Because of this, I believe it will end up in E because that is the direction the points are going in at the present and it seems its starting to decline again so I believe it will be in E before starting to make an increase again.",,,61,,,,,,,,,,,1,5c4fe78f8ac59200014cf239,ThinkMore,ItemConfidence
7/19/2023 10:32,7/19/2023 10:52,0,100,1185,1,7/19/2023 10:52,R_33lnQxoHki2fcm5,anonymous,EN,,,,,,,,,,,,,,,,,,,,,,,,,,,,,Stock 2 of 5:,4,,The stock has dropped and it is a good time to buy at a low price there is a high probability of the stock price raising as per the prediction chart ,"Buy the stock as the price is good at a low rate. According to the prediction chart, it will start going up as it has happened before",100,,,,,,,,,,,,,,,,,,,,,,,Stock 3 of 5:,6,,Sell the stock as it shows that the stock is going down it will take time for it to go up,The chart show a high probability of the stock still declining is a good time to sell,91,,,,,,,,,Stock 4 of 5:,3,,"Stock is going up is a good time to buy, it shows that it will stay this way for a long time ","Very good time to buy, stock very positive time to invest ",99,,,,,,,,,Stock 5 of 5:,4,,The stock has the potential of going up a good time to buy as the price is low and a good time to make a lot of return,Buy the stock now it is a good time to buy as it will turn to a bull very soon ,100,,,,,,,,,Stock 1 of 5:,3,,"The stocks have the potential of being in the bull period, a good time to invest ",The stock for this company is in a growing state as the company is doing well ,90,,,,,,,,,,,,,,,,,,,,,,,,,,,,,,,,,,,,,none ,How people make investment decisions from market forecasts and predictions ,3,5e8e38da572c650e2ede51c9,ThinkDifferent,ItemConfidence
7/19/2023 10:23,7/19/2023 10:54,0,100,1846,1,7/19/2023 10:54,R_2QPQJtnQDPKpYKU,anonymous,EN,,,,,,,,,,,,,,,,,,,,,,,,,,,,,Stock 4 of 5:,5,,We are clearly testing a downward trend held by a thread in the E zone that will tend to hold or not.,We are testing a downward trend caught by a thread in the E zone which is likely to be broken through to the F zone.,,0,0,0,0,50,50,0,0,,,,,,,,,,,,,,,Stock 5 of 5:,5,,"Zone E shows us a reality that will tend to hold for the next few weeks, moving sideways in this region.","If we look at the Macro indicators of the market as a whole and consider that a recession could happen, it does not seem unreasonable that the E zone ceases to be a support and gives way to the F zone.",,0,0,0,15,80,5,0,0,Stock 3 of 5:,4,,"There is a solid upward trend, which may continue in D.","All fast and intense climbs are subject to corrections; as such, the most realistic scenario will be for the same to occur, at least in the E zone, for a while.",,0,0,0,40,60,0,0,0,Stock 1 of 5:,5,,"The trend of the last point is slightly upward from the previous one, so there is support for prices to remain at E.","Considering the downward trend of the market as a whole, the support will probably be broken even slightly by testing the F-point zone.",,0,0,0,13,70,17,0,0,,,,,,,,,,,,,,,Stock 2 of 5:,4,,"There is a support line in the D zone, and it will likely stay there.",There is clearly a support line in zone D which has been broken twice and is likely to be broken again moving into that E zone.,,0,0,0,60,40,0,0,0,,,,,,,,,,,,,,,,,1,5bdc97be76d6d50001bc2c84,ThinkDifferent,Histogram
7/19/2023 10:23,7/19/2023 10:39,0,100,950,1,7/19/2023 10:54,R_1M6u9IszJiqiqBE,anonymous,EN,Stock 5 of 5:,3,"The stock has gradually increased in price, and the momentum of these increases has particularly gained just recently, with the biggest weekly rise, from band D to Band C. I believe this upward trend will continue for now, with only small price drops, and so the price will most likely stay in band C.",,,80,,,,,,,,,,,,,,,,,,,,,,,Stock 1 of 5:,5,"The price of the stock seems to fluctuate quite a lot, it will go down and then go up again. I see a recent pattern of slight increases, and so after the last couple of prices were stable, I think the price will have another small rise.",,,70,,,,,,,,,,,,,,,,,,,,,,,,,,,,,,,,,,,,,,,,,,,,,,,,,,,,,,,,,,,,,,,,,Stock 3 of 5:,5,"This stock has a pattern of many rises and falls in price, these prices differences are gradual and small. The recent behaviour has shown the highest price of the stock yet, however due to the pattern, I will believe the price will drop again.",,,66,,,,,,,,,Stock 4 of 5:,4,"The stock has overall a pattern of increasing in price, it has climbed quite steadily in the past few months. There have only been quite small declines, before the upward trend continues. I believe that this trend upwards will carry on, and so I believe there will be another price rise, although not a large one.",,,70,,,,,,,,,Stock 2 of 5:,4,"Looking at the past price behaviour, I can see that the stock has had a slow and steady rise, followed by a steady decline. Now the recent pattern seems to show a slow rise again, and I believe that again the stock will hit another peak before falling, I think the rise is still ongoing and so a small steady rise within the same bin is most likely.",,,80,,,,,,,,,,use of data to make future predictions,1,5ef647ec3ce68a1178780f5a,ThinkMore,ItemConfidence
7/19/2023 10:34,7/19/2023 10:54,0,100,1227,1,7/19/2023 10:54,R_2fq9ybQNsRn8pJU,anonymous,EN,,,,,,,,,,,,,,,Stock 1 of 5:,3,"Has Weeks Going Up. It Remained A Little In ""D"" But The Trend Is Up. It is very likely that it can finally go up to C.
",,,,0,0,45,40,15,0,0,0,,,,,,,,,,,,,,,Stock 4 of 5:,4,"It comes very stable in its variation. Holds With Slight Upward Movement. This week will remain firm in that container.
",,,,0,0,10,60,30,0,0,0,Stock 5 of 5:,5,"It has some stability. It remains for a couple of weeks and then we will finally see the move to another container. I do not see him unstable in his behavior..
",,,,0,0,0,30,50,20,0,0,,,,,,,,,,,,,,,Stock 2 of 5:,5,"He's had enough of a fall. It's just a feeling that it's going to settle down to its minimum eventually.
",,,,0,0,10,30,40,20,0,0,,,,,,,,,,,,,,,,,,,,,,,,,,,,,Stock 3 of 5:,5,"It is very unstable in the last few weeks! Anything Can Happen.... I Follow The Trend Between Ups And Downs. Going Little Down.
",,,,0,0,25,30,40,5,0,0,"I would have liked to see the results of the graph after finishing each 1.
","The Probabilities and Predictions of How It Can Go Down, Up or Stay. Our Perception. It's like I put money in it and win or lose. Like BITCOIN I buy cheap and I can sell expensive.
",3,5bdf91dbb32fa800012ea282,ThinkMore,Histogram
7/19/2023 9:17,7/19/2023 9:54,0,21,2215,0,7/19/2023 10:54,R_pyDxLVX0fxri5YB,anonymous,EN,,,,,,,,,,,,,,,,,,,,,,,,,,,,,,,,,,,,,,,,,,,,,,,,,,,,,,,,,,,,,,,,,,,,,,,,,,,,,,,,,,,,,,,,,,,,,,,,,,,,,,,,,,,,,,,,,,,,,,,,,,,,,,,,,,,,,,,,,,,,,,,,,ThinkMore,Histogram
7/19/2023 10:24,7/19/2023 10:55,0,100,1854,1,7/19/2023 10:55,R_x8X2dsXQJKQMqsh,anonymous,EN,Stock 5 of 5:,3,"I believe the price of stock to be in bin 'C' when hitting the red line. 
At the start of the graph one can see a relatively stable trend, with downwards inclining prices. 
This however is obviously followed by an explosive increase in stock price. 
In the middle of the graph the line fluctuates within the 'E' bin, after which it rapidly rises into 'C' within four weeks. 
I believe this rapid increase to be unlikely to keep on until hitting the red line. 
As seen in the middle of the graph the price will have to first find stable footing, before it might continue increasing, or maybe even dipping back down. 
For these reasons I predict the price of stock to be in the 'C' bin when hitting the red line.",,,70,,,,,,,,,Stock 2 of 5:,3,"I believe the price, when hitting the red line, will be in bin 'C'. 
From the information given in the graph there seems to be a very clear and stable upwards trend. Though there are slight deviations,one could draw a clear line from the starting-point to the end-point and following it will see the line likely to continue into the high end of bin 'C'.
From this graph I have no reason to believe this upwards trend will be discontinuing any time soon. 
I firmly believe the price of the stock to be in the high end of bin 'C'.",,,90,,,,,,,,,Stock 4 of 5:,5,"I believe the price of stock to be in bin 'E' when hitting the red line.
The trend shown to me in the given graph is one of decline. In the very early weeks shown in the graph one can see a quite stable line, sitting at slightly below 100. 
After that follows an obvious drop in price, with a slight recovery into bin 'C'. 
This is followed by another decline in price. 
However, the decline in the final few drops seems to imply that the price drop is slowing down quite significantly. 
From here I believe it the price to stabilize and, ever so slowly, remain or recover into bin 'E' when hitting the red line. ",,,75,,,,,,,,,,,,,,,,,,,,,,,,,,,,,,,,,,,,,,,,,,,,,,,,,,,,,,,,,,,,,,,,,Stock 3 of 5:,4,"I believe the price of the stock to be in bin 'D' when hitting the red line. 
The trend shown in the graph is one of a slow yet stable incline. When continuing the shown trend the price would end in the higher end of bin 'D'. 
At the very start of the graph one can see a slight valley, followed by a relatively quick peak. This shows that there was some turbulence in price before, but that it has since stabilized. The turbulence itself was relatively slight and the price remained within the area of a single bin.
This is why I believe that the price will be in bin 'D' at the time of the red line.  ",,,80,,,,,,,,,,,,,,,,,,,,,,,Stock 1 of 5:,5,"The dots show a clear pattern; It has peaks and valleys, with a slight downward trend of the average. The average is hovering between 90 and 100. If I am to make a prediction on the current graph I predict the downward trend to continue slowly, while still making peaks and valleys.
I predict the dots to go down and valley into bin 'F' _before_ the red line, and recovering into 'E' when coming to the red line, if only slightly. 

The line might continue after the red line, peaking around 90 in 'E', before going slowly declining into 'F'.",,,85,,,,,,,,,Thank you for involving us in your study and the best of luck. ,"I believe this study to test how confident people are in predicting trends without any real information presented to them. 
Maybe something related to fooling oneself into believing their own ideas? ",1,6428caa789609d52890a3c99,ThinkMore,ItemConfidence
7/19/2023 10:23,7/19/2023 10:31,0,100,453,1,7/19/2023 10:56,R_3foCwB3RvAmLhwE,anonymous,EN,Stock 5 of 5:,2,A steep upwards incline means that by prediction in week 10 it would land in B. I am calculating this based off the current graph trend,,,60,,,,,,,,,,,,,,,,,,,,,,,Stock 2 of 5:,7,Trending downwards and each week there is a WoW decline we can expect this stock to trend downwards until an event or market shift changes this ,,,30,,,,,,,,,,,,,,,,,,,,,,,Stock 1 of 5:,5,The majority of the stock is trending in E. additionally towards the end of the sequence it falls within the E bracket. We can assume at 10 weeks this is where the stock will also fall. ,,,60,,,,,,,,,Stock 3 of 5:,3,A rise is occurring we can anticipate that this will continue to rise following to the 10 week mark. The decline is steady and slow and would resultingly land in C,,,45,,,,,,,,,,,,,,,,,,,,,,,,,,,,,,,,,,,,,Stock 4 of 5:,4,A positive trend with some anomaly out layers would indicate that the stock would land in D. Based on this we can assume the range,,,31,,,,,,,,,,,,,,,,,,,,,,,Easy to tell a ball park but this doesn’t factor in external events. Prediction was much harder than anticipated. ,Risk,2,5f1efa006ba46a05e161bc68,ThinkMore,ItemConfidence
