7/19/2023 10:22,7/19/2023 10:57,0,100,2060,1,7/19/2023 10:57,R_1l6prh8HrqHkjrf,anonymous,EN,Stock 2 of 5:,3,,"We are on an upward wave and have been recording better and better results for a good dozen weeks. The recent quarterly results and the successful launch of their latest flagship product have meant that there is nothing to worry about, and investing in this company is putting your money in a good place with the certain prospect of no losses. Join us and surf higher and higher with us!","Recognizing potential market fluctuations and investor sentiment, it's crucial to exercise caution and consider the possibility of a downward trend. Stay informed, assess the risk factors, and position yourself wisely to potentially capitalize on a lower price range.This is especially important in this case, when the trend is so upward that an imminent correction becomes inevitable. Therefore, it is important not to invest money now, a certain market correction will make a quick short-term profit impossible.",,2,3,30,24,16,11,8,6,,,,,,,,,,,,,,,,,,,,,,,,,,,,,Stock 4 of 5:,4,,"Based on meticulous analysis and a deep understanding of market dynamics, the evidence strongly suggests that the final price of the stock is likely to land in a bin ""C"". But why? Here's the answer,  Historical patterns and recent market trends indicate a sustained upward momentum, presenting a compelling opportunity for potential gains. Mainly because, the company has shown some really good moves in the market lately and it is estimated that they are capable of reaching their highest value ever.","It is prudent to exercise caution and consider the possibility of a lower price range, ensuring you make informed investment decisions. By anticipating a potential decline, you can position  yourself to take advantage of favorable buying opportunities and mitigate potential risks.There are many other much more reliable companies that will guarantee a certain profit.",,2,7,17,26,22,15,7,4,,,,,,,,,,,,,,,Stock 1 of 5:,4,,"As a experiences trader and based on the available information above, it is highly likely that the final price of the stock will land in a bin above the one I previously mentioned ( D in this case). Extensive analysis of historical stock data and market trends strongly indicates an upward trajectory, leading us to anticipate a higher price range (take a look at initial price). Don't miss out on this opportunity to potentially capitalize on the stock's upward momentum. Make an informed investment decision and seize the potential for greater returns. Such an opportunity may not happen again!","Historical trends and patterns suggest a potential downward movement, presenting an opportunity to make strategic investment decisions. Don't overlook the possibility of a lower price range and be prepared to take advantage of potential market adjustments. Stay vigilant and position yourself for potential gains in a changing market landscape.The good times are behind us, with unavoidable declines ahead. The market correction will cause some capital to evaporate from stocks, be sure it won't be your money! :)",,7,13,20,22,17,15,4,2,Stock 3 of 5:,6,,"Don't miss out on the opportunity to ride the upward momentum and potentially reap significant returns!!!.Make an informed investment decision and position yourself strategically to capture the potential gains in the higher price range. Look at the chart of the company, recent losses are the highest ever and the market is waiting for the old prices to return, this is the moment to invest! Catch a falling knife before others do! Let's go, to the moon!","Careful analysis of the available data and market trends suggests that the final price of the stock is more likely to land in a bin below the one previously mentioned. Historical patterns and indicators point to a potential downward movement in the stock's price.This is mainly supported by the fact that the latest fiscal reports for last year make potential shareholders aware of the difficult situation the company is in, weather the storm. Reap the profits later! Now is not the best time for that.",,7,9,13,18,22,18,9,4,Stock 5 of 5:,4,,"Based on thorough analysis and comprehensive market research, all indications point towards the final price of the stock landing in a bin C, sstable growth noticeable from the very beginning of the charts indicates that the company is building its value on the stock market, dictated by and steadily growing position in a market in which they have an increasing share. This beautiful correlation is an unprecedented opportunity for a sure and fast profit.","Exercise prudence and make informed investment decisions to safeguard your portfolio and navigate the market effectively! Take a look at the chart! The market is getting saturated! And the growth momentum is slowing down, after all, how much can share prices rise, especially since the price per share seems to be out of touch with reality, but rather reflects the market's exorbitant expectations. It's not worth the risk, we make decisions based on cold calculation and not on exaggerated market expectations, right?",,6,10,18,27,17,11,9,2,,,,,,,,,,,,,,,,,,,,,,,,,,,,,"I tried very hard, and I think that's the most important thing! For several minutes I felt like some broker who could sell his advice to anyone ",I honestly have no clue,2,5f108dea719866356702d26f,ThinkDifferent,Histogram
7/19/2023 10:23,7/19/2023 10:57,0,100,2040,1,7/19/2023 10:57,R_2q2AU8PWUE1tkrB,anonymous,EN,Stock 4 of 5:,3,"Lately this price increased significantly, so I don't think there will be a further increase. It's most likely that the price stays on the same level.",,,55,,,,,,,,,,,,,,,,,,,,,,,Stock 2 of 5:,6,There's been a long term tendency for the price to decrease. I suspect it may continue and the price will decrease further. ,,,50,,,,,,,,,,,,,,,,,,,,,,,Stock 5 of 5:,5,For the few weeks the price stayed on the same level. It's most likely that this tendency will continue.,,,75,,,,,,,,,,,,,,,,,,,,,,,Stock 1 of 5:,5,"Lately the price decreased significantly, so instead of a further decrease I suspect there might be a slight increase or it stays on the same level.",,,65,,,,,,,,,Stock 3 of 5:,4,"There's been a long term tendency for the price to increase. I believe it's most likely that the price will increase further, though not by a lot.",,,85,,,,,,,,,,,,,,,,,,,,,,,,,,,,,,,,,,,,,,,2,5f245764a137ac00089e6c7d,ThinkMore,ItemConfidence
7/19/2023 10:23,7/19/2023 10:57,0,100,2063,1,7/19/2023 10:57,R_eKGG4OteorvJjNL,anonymous,EN,,,,,,,,,,,,,,,Stock 1 of 5:,3,,"The stock has risen sharply in just a period of a few weeks multiple times. For an example, it rose from 115 to 125, or 125 to 135 in just 3 weeks. It has also constantly been rising, so it's very likely that it will end up between 145 and 155.","While this stock has generally been rising, they always fall off sooner or later. This stock has struggled to break through 135, and this last week it fell off rather sharply. It's looking likely that it will fall now, though probably not too quickly as it might get minor upticks before falling again. I think it's likely that it will stay in the 125-135 bracket, though at the lower end by the end of the 10 weeks.",65,,,,,,,,,Stock 4 of 5:,6,,"Although this stock has been trending down generally, the last 4 weeks have barely had any change at all. This indicates that it has stabilized, just like it had in the beginning of the graph where there was 8 weeks of almost no change before a sharp drop. With the stabilized price, it's likely to continue in the 70 to 80 bracket.","This stock has been trending down for a long time. It took the price 8 weeks to fall from 80 to 70, so it's likely to fall further than 10 units in 10 weeks, and thus likely ending up somewhere in the high end of the 50 to 60 bracket.",80,,,,,,,,,Stock 2 of 5:,4,,"This stock has been going up and down constantly, but it always goes up more sharply than it goes down. Looking at the amount of weeks in the up and down waves, it looks like it is likely to get an upward spike about now. Therefor, it is likely to end up in the 110 to 120 bracket.","This stock has been falling almost every one of the last 9 weeks. It is not falling too quickly though, and getting some minor upticks every now and then, so it should not rapidly decline. It will probably fall slightly down to the 90 to 100 bracket in the coming 10 weeks period.",40,,,,,,,,,,,,,,,,,,,,,,,Stock 5 of 5:,4,,"This stock has after a period of going down, started rising fairly quickly the last few months. Almost every week has risen to a new height. In the coming 10 weeks period, it thus looks extremely likely to continue rising all the way up to the 110 to 120 bracket.","This stock has after a period of going down, started rising fairly quickly the last few months. When it rise this quickly, it's very volatile and prone to fall off again, before stabilizing. Especially the last weeks rise was rather large, so I think it's likely to fall off a bit and end up in the 90 to 100 bracket after 10 weeks.",31,,,,,,,,,Stock 3 of 5:,6,,"This stock has been mostly unchanged, with minor up and down variations. Then, it suddenly took a deep plunge, so we can assume that something big happened about 4 weeks ago. However, this last week it went slightly up again, so we can assume that the situation has stabilized, and it will likely continue to do so in the next 10 week period.","This stock has been mostly unchanged, with minor up and down variations. Then, it suddenly took a deep plunge, so we can assume that something big happened about 4 weeks ago. Though the last week was mostly unchanged it is very much trending down and that week may very well have been a one off. It's like to continue falling well into the 65 to 75 bracket.",50,,,,,,,,,,,,,,,,,,,,,,,,,,,,,,,,,,,,,,,,,,,,,,,,,,,,,1,5e2df2855e01ef3e5d01ab58,ThinkDifferent,ItemConfidence
7/19/2023 10:23,7/19/2023 10:58,0,100,2146,1,7/19/2023 10:58,R_2zC3Drpky5Y0WFs,anonymous,EN,,,,,,,,,,,,,,,,,,,,,,,,,,,,,Stock 2 of 5:,6,"Based on the data from the chart we can see the bearish trend of the market, I also believe that stocks will continue to fall over the next couple of weeks",,,,0,0,0,5,30,60,5,0,,,,,,,,,,,,,,,,,,,,,,,,,,,,,Stock 4 of 5:,4,"I see the chart shows an upward trend, so personally I think the price will rise in the next few weeks",,,,0,0,20,80,0,0,0,0,Stock 5 of 5:,5,"on the chart,we can see that the price has gone down sharply,but we can also see by the dots that there is a slight correction,so we have a chance to return to the price increase",,,,0,0,0,35,65,0,0,0,Stock 1 of 5:,4,"The price will land in the expected bin due to a combination of factors including market demand, supply dynamics, and external influences.",,,,0,0,15,50,30,5,0,0,,,,,,,,,,,,,,,Stock 3 of 5:,4,"looking at the chart, we can see that the price changes cyclically,so in my opinion it will go slightly down",,,,0,0,10,40,30,20,0,0,,,4,6081728972120aa7f9685791,ThinkMore,Histogram
7/19/2023 10:23,7/19/2023 10:59,0,100,2148,1,7/19/2023 10:59,R_Y9c3kTlToIJGonf,anonymous,EN,Stock 4 of 5:,2,,Well there is a strong inclination for the price to continue going up. It has been going up for quite a while. Maybe the stock is maintaining a good reputation and more people see an opportunity to buy. There is no sign of a decrease.,There isn't a high chance of the price going down. It looks like a strong upward trend. But not limiting it to only going up but I think it's positive to think it will continue going up for a while instead of down.,,0,40,50,10,0,0,0,0,,,,,,,,,,,,,,,,,,,,,,,,,,,,,,,,,,,,,,,,,,,,,,,,,,,,,,,,,Stock 3 of 5:,4,,The price looks to be going up in a stable way but very slowly. It could take a while for it to reach C. But will probably move more towards it.,The price might approach E but the chances are very slim. There is no indication of the price wanting to go down.,,0,0,5,95,0,0,0,0,Stock 1 of 5:,4,,"Alright, I don't know much about such things but I believe that the price has gone down to its lowest. This could be because of an event that happened or something. I believe it went down because it had a lot of sellers and now, there can only be so many sellers in the market. It has had so much sellers, I doubt that there are a lot of sellers still or rather I believe that the probability for the market to go down further is very slim. But there is a lot of opportunity for it to go up to maybe between D and C which is the average it has been in a long time.","With the position at E, I believe it is a conservative way of thinking. If I was trying to think conservatively, scared to make rash or risky decisions, I would probably go for E which means that the price will only go slightly up but not too much. ",,0,0,10,60,30,0,0,0,Stock 5 of 5:,4,,The price is not moving up or down much and has been that way for a while. I do not see any inclination for the price to go high at a high rate. It might go but not to a significant degree.,The probability for the price to go as low as position E are very slim. There seems not to be any motivation to say it will significantly move down a great deal.,,0,0,3,94,3,0,0,0,,,,,,,,,,,,,,,Stock 2 of 5:,4,,The position at C looks like a reach for the short term. It might go towards C but I'm not too sure if it will actually reach it fully. I do see a strong upward price trend and but also an equally downward price trend. It might stay in the D position for a while and could move either way. It's a tough one.,The position at E is also similar to the one at C. It could really go either way and D is a conservative choice. ,,0,0,5,90,5,0,0,0,It was kind of interesting. I have no idea how those prices work but it would be nice to learn what influences each.,The way a person thinks and reasons given specific information.,2,615f85189f74d04c4a29c56b,ThinkDifferent,Histogram
7/19/2023 10:23,7/19/2023 10:59,0,100,2187,1,7/19/2023 10:59,R_22Ly0o8D0TfX6LL,anonymous,EN,Stock 1 of 5:,4,,I choose C because I feel like the price in the next 10 weeks will be lower than it is now due to the act that the stock exchange price is unpredictable and did not have a strong starting point which may make it likely for it to fall.,As said earlier the stock price did not have a strong exchange point and also this may deter others from having interest or purchasing this stock.,,11,15,68,6,0,0,0,0,Stock 5 of 5:,3,,I chose C because it had a nice increase even though the stock price did not have a strong start.,The stock price for this company will increase because even though the beginning was not that huge but it had a pretty much nice increase in the last couple of weeks which may draw the attention of investors.,,0,32,56,12,0,0,0,0,,,,,,,,,,,,,,,Stock 4 of 5:,4,,I chose D because I think it won't have a huge change.,The stock price for this company will have a little to no increase in the next ten weeks even though it had a nice beginning but the last couple of week was not good.,,0,0,0,43,57,0,0,0,,,,,,,,,,,,,,,Stock 2 of 5:,3,,I choose C because I think that the stock closing price will raise in the next 10 weeks ,The stock closing for this company will raise as seen in the chart it had a high starting point which is a good beginning and even though the price dropped a little after some time but it still has an attractive stats which will probably rise.,,29,64,7,0,0,0,0,0,Stock 3 of 5:,5,,I choose E because I think the stock price will remain the same.,The stock price for this company had an interesting and a high stock price but had a drastic fall in its price so i think the price will remain the same.,,0,0,0,0,65,35,0,0,,,,,,,,,,,,,,,,,,,,,,,,,,,,,,,,,,,,,,,,,,,,,1,64a9c85cd18d2853ec8eca4d,ThinkDifferent,Histogram
7/19/2023 10:23,7/19/2023 11:00,0,100,2189,1,7/19/2023 11:00,R_1jvP5ilttNMA8DK,anonymous,EN,,,,,,,,,,,,,,,,,,,,,,,,,,,,,Stock 1 of 5:,6,"The price is been constantly declining for over 10 plus weeks and it takes roughly around 11 weeks for the price to fall in the next bin. looking at the rate at which it is declining, it is safe to say after 10 weeks, the price will land in F bin unless the trend changes.",,,70,,,,,,,,,Stock 4 of 5:,3,"The pattern of the graph is constant throughout the weeks, it goes down the it goes up. so if this trend continues, then its safe to say the price will go up and it will likely land in bin C after 10 weeks ",,,50,,,,,,,,,,,,,,,,,,,,,,,Stock 5 of 5:,5,the price is constantly focused in bin E for the past weeks. if this trend continues for the next 10 weeks then the price will land in bin E,,,91,,,,,,,,,Stock 3 of 5:,4,"The price is more focused in bin D. the price increases and then decreases back to bin d and the other way around. so it is safe to say after 10 weeks, the price will land in bin D",,,40,,,,,,,,,,,,,,,,,,,,,,,,,,,,,,,,,,,,,Stock 2 of 5:,5,"The price fluctuates constantly between bin D and E and it roughly takes about 4 to 5 weeks for the price to land in another bin. so if this trend continues for the next 10 weeks, then the price will likely land in bin E. ",,,60,,,,,,,,,,how well can human predict stock prices ,2,615eb4359e91a19283b519cf,ThinkMore,ItemConfidence
7/19/2023 10:23,7/19/2023 11:00,0,100,2214,1,7/19/2023 11:00,R_WkYhR7jc7zMmoyR,anonymous,EN,Stock 5 of 5:,1,,The chart is showing that the price is in its third wave to the upside. In Elliot Wave theory the third wave extends the longest to the upside. The chart is looking very bullish.,The chart is looking bullish but weakness is showing. The price may increase a little bit further but a correction is looking very likely. The price appears to be making its final move to the upside before it corrects hard.,,41,38,6,5,4,3,2,1,Stock 2 of 5:,2,,The price is trending positively in a consistent manner. There are no extreme variances. A steady increase in price is more sustainable than an exponential move to the upside that can result in the price peaking and then coming down afterwards.,"With the price increasing as it has done, it is due a pull back. The price has increase by about 40% without any significant reduction. As sellers start to take profit, the price will decrease and complete a ABC correction before rallying higher.",,4,27,24,2,24,11,4,4,,,,,,,,,,,,,,,,,,,,,,,,,,,,,Stock 4 of 5:,3,,"The price has made a lower high and is trending upwards. It is likely to make a higher high, which will be just above the last peak. The price is not that volatile so it will not decrease or increase considerably.","The chart is looking weak. It has decreased in price close to its initial price. if it increased again then it will make a lower high than before, so price will end up in bin B or below.",,2,2,24,44,25,1,1,1,,,,,,,,,,,,,,,,,,,,,,,,,,,,,,,,,,,,,,,,,,,Stock 1 of 5:,6,,The chart looks as if it has peaked and a dead cat bounce has just taken place. The final dot is below the peak. It looks like the chart has turned bearish and the price is about to start declining.,"The chart looks as if it has peaked and a dead cat bounce has just taken place. The final dot is below the peak. It looks like the chart has turned bearish and the price is about to start declining. In these circumstances its hard to know where the floor is, but as panic sets in, people will start selling driving the price down further causing a bear market.",,7,13,21,3,8,26,15,7,Stock 3 of 5:,6,,"The chart is trending downwards. It looks as though the price will drop down to the G bin before rallying up again and ending in Bin F. The price has been setting lower highs and lower lows so until there is a reversal, the pattern will continue.","The chart is trending downwards. It looks as though the price will drop down to the bin G before rallying up to bin F and then fall below bin G. The price has been setting lower highs and lower lows so until there is a reversal, the pattern will continue.",,1,1,1,2,47,34,11,3,,,1,647e06e4564c6d08e99046a2,ThinkDifferent,Histogram
7/19/2023 10:23,7/19/2023 11:00,0,100,2219,1,7/19/2023 11:00,R_21n8Rsd2UnhbKcy,anonymous,EN,Stock 3 of 5:,1,This graph seems to have high lows but high highs. What I mean is when it goes low it goes not go too low but when it goes high it goes very high. So I can see it going a little low and then going high in the next 10 weeks.,,,,22,42,7,12,15,2,0,0,,,,,,,,,,,,,,,Stock 4 of 5:,6,"Prices seem to really be struggling to go up, even when they do go up it is not by much. I suspect it will carry on like this for a while. ",,,,0,1,9,26,19,26,15,4,Stock 5 of 5:,4,"It went from 100 to 90 then back to 100 only to go back from 100 towards 90 again, then went up and had a breakout almost reaching 110. It went down from there but I think since it didn't go down too far it will go back towards 110.",,,,4,7,19,30,14,12,10,4,Stock 1 of 5:,4,"Prices will altimately always go up and down, it seems here that the prices have gone down and are now inevitabley rising. I placed it at D because I had a 10 window, so I calculated the dots to find out how much their prices usually rise in a ten week period and I landed on D.",,,,1,3,19,55,15,3,3,1,Stock 2 of 5:,3,"While the price did drop, it has been on a steady upward trend that I think can only go up from here. Also the drop was not that low and the recovery looks impressive enough.",,,,1,1,31,57,5,2,2,1,,,,,,,,,,,,,,,,,,,,,,,,,,,,,,,,,,,,,,,,,,,,,,,,,,,,,,,,,,,1,60aadeb9e6e8147089f7eced,ThinkMore,Histogram
7/19/2023 10:22,7/19/2023 10:46,0,100,1381,1,7/19/2023 11:01,R_1LFIEx85My6Umym,anonymous,EN,Stock 1 of 5:,6,,"While analyzing historical stock price data for a certain company, I stumbled upon a rather straightforward yet compelling prediction method: calculating the average closing price of the observed weeks to forecast the stock's value in 10 weeks. At first, I was intrigued by its simplicity, but the more I considered it, the more convinced I was, for example, the company's stock seems to exhibit a relatively stable and consistent trend over the observed weeks. By taking the average, we can capture the overall trajectory and potentially extend it into the future, also, the average method helps mitigate the impact of short-term fluctuations or external noise that might be present in the data. This can be particularly useful when we want to focus on the long-term perspective, given this information I think something around the E bin is going to be a good choice.","Given that we are living in hard times I would bet on something around the G bin which is more or less what we started the graph with, an since we know that it climbed pretty decently during this week we can expect it to drop and the rise again, so it will probably keep the starting value on an average scale if nothing unexpected happens in the meantime ",65,,,,,,,,,,,,,,,,,,,,,,,,,,,,,,,,,,,,,,,,,,,,,,,,,,,Stock 2 of 5:,5,,"In my opinion we can see a trend, if 100 is our starting point we can see that during a week we go up to 120+ and then come back down to around 105, with this information in place and thinking about the average method, and also, being a little optimistic, we can predict it will be around in the D bin with an average value of 115","Knowing that inflation has been affecting companies on a large scale and also the stock market we can expect the possibility of our shares ending up in the F bin because although we seen a nice uplift and even when it comes back down it keeps above the starting point, we can expect it to drop in the long term",70,,,,,,,,,,,,,,,,,,,,,,,,,,,,,,,,,,,,,Stock 4 of 5:,5,,"Having a very good few weeks we can expect the stocks to come down and the up again, so in 10 weeks we will be able to see it land in the D bin as we can see right now","Having some trouble with inflation we can expect this upwards trend to end and see the stocks start to climb down again, so we can expect to see them in the F bin in 10 weeks",70,,,,,,,,,Stock 3 of 5:,5,,"Looking at this graph we can very optimistically say that we will see the stock hit the D bin after 10 weeks because we are seeing an upwards trend, to which I expect it to fall and then climb again giving us that D bin as we can see in this graph","In 10 weeks we can surely see the F bin as the place for our stocks, since it is in a positive state we know it might and probably will come down, and F is still somewhat positive given where we started at",60,,,,,,,,,Stock 5 of 5:,4,,"As wee can see in this graph we know the stocks for this company tend to peek and then come down, so we can expect to see a peek in the C bin in 10 weeks just before in comes down again, just like we see in this graph",Given that this stocks are a bit unstable we can expect to see them drop into the E bin in a few weeks due to volatility and inflation,50,,,,,,,,,,"How someone can try to predict where a stock while land, given limited information about their value",3,5ea2e107a4d6af04981e71e9,ThinkDifferent,ItemConfidence
