StartDate,EndDate,Status,Progress,Duration (in seconds),Finished,RecordedDate,ResponseId,DistributionChannel,UserLanguage,1_LoopNo,1_ChooseBin,1_ThinkMore,1_ThinkDifferentHigh,1_ThinkDifferentLow,1_ItemConfElicitation_4,1_HistogramElicitation_4,1_HistogramElicitation_5,1_HistogramElicitation_6,1_HistogramElicitation_7,1_HistogramElicitation_8,1_HistogramElicitation_9,1_HistogramElicitation_10,1_HistogramElicitation_11,2_LoopNo,2_ChooseBin,2_ThinkMore,2_ThinkDifferentHigh,2_ThinkDifferentLow,2_ItemConfElicitation_4,2_HistogramElicitation_4,2_HistogramElicitation_5,2_HistogramElicitation_6,2_HistogramElicitation_7,2_HistogramElicitation_8,2_HistogramElicitation_9,2_HistogramElicitation_10,2_HistogramElicitation_11,3_LoopNo,3_ChooseBin,3_ThinkMore,3_ThinkDifferentHigh,3_ThinkDifferentLow,3_ItemConfElicitation_4,3_HistogramElicitation_4,3_HistogramElicitation_5,3_HistogramElicitation_6,3_HistogramElicitation_7,3_HistogramElicitation_8,3_HistogramElicitation_9,3_HistogramElicitation_10,3_HistogramElicitation_11,4_LoopNo,4_ChooseBin,4_ThinkMore,4_ThinkDifferentHigh,4_ThinkDifferentLow,4_ItemConfElicitation_4,4_HistogramElicitation_4,4_HistogramElicitation_5,4_HistogramElicitation_6,4_HistogramElicitation_7,4_HistogramElicitation_8,4_HistogramElicitation_9,4_HistogramElicitation_10,4_HistogramElicitation_11,5_LoopNo,5_ChooseBin,5_ThinkMore,5_ThinkDifferentHigh,5_ThinkDifferentLow,5_ItemConfElicitation_4,5_HistogramElicitation_4,5_HistogramElicitation_5,5_HistogramElicitation_6,5_HistogramElicitation_7,5_HistogramElicitation_8,5_HistogramElicitation_9,5_HistogramElicitation_10,5_HistogramElicitation_11,6_LoopNo,6_ChooseBin,6_ThinkMore,6_ThinkDifferentHigh,6_ThinkDifferentLow,6_ItemConfElicitation_4,6_HistogramElicitation_4,6_HistogramElicitation_5,6_HistogramElicitation_6,6_HistogramElicitation_7,6_HistogramElicitation_8,6_HistogramElicitation_9,6_HistogramElicitation_10,6_HistogramElicitation_11,7_LoopNo,7_ChooseBin,7_ThinkMore,7_ThinkDifferentHigh,7_ThinkDifferentLow,7_ItemConfElicitation_4,7_HistogramElicitation_4,7_HistogramElicitation_5,7_HistogramElicitation_6,7_HistogramElicitation_7,7_HistogramElicitation_8,7_HistogramElicitation_9,7_HistogramElicitation_10,7_HistogramElicitation_11,8_LoopNo,8_ChooseBin,8_ThinkMore,8_ThinkDifferentHigh,8_ThinkDifferentLow,8_ItemConfElicitation_4,8_HistogramElicitation_4,8_HistogramElicitation_5,8_HistogramElicitation_6,8_HistogramElicitation_7,8_HistogramElicitation_8,8_HistogramElicitation_9,8_HistogramElicitation_10,8_HistogramElicitation_11,9_LoopNo,9_ChooseBin,9_ThinkMore,9_ThinkDifferentHigh,9_ThinkDifferentLow,9_ItemConfElicitation_4,9_HistogramElicitation_4,9_HistogramElicitation_5,9_HistogramElicitation_6,9_HistogramElicitation_7,9_HistogramElicitation_8,9_HistogramElicitation_9,9_HistogramElicitation_10,9_HistogramElicitation_11,10_LoopNo,10_ChooseBin,10_ThinkMore,10_ThinkDifferentHigh,10_ThinkDifferentLow,10_ItemConfElicitation_4,10_HistogramElicitation_4,10_HistogramElicitation_5,10_HistogramElicitation_6,10_HistogramElicitation_7,10_HistogramElicitation_8,10_HistogramElicitation_9,10_HistogramElicitation_10,10_HistogramElicitation_11,Comments,Q46,Q61,Q39,Writing,Elicitation
7/19/2023 9:17,7/19/2023 9:30,0,100,770,1,7/19/2023 9:30,R_2Yzi2oq8dl1QnjW,anonymous,EN,Stock 1 of 5:,5,,"I chose D because we can observe that over the years the point was to remain in D and remain stable there
","I chose F because we can observe that over the years the point was to remain in F and remain stable there
",91,,,,,,,,,,,,,,,,,,,,,,,,,,,,,,,,,,,,,Stock 5 of 5:,4,,I think that in my perspective it will increase to C and not decrease,I think from my perspective it will go down to E and not increase,87,,,,,,,,,,,,,,,,,,,,,,,Stock 3 of 5:,5,,"
I think from my perspective it will go up to D and not down","I think from my perspective it will go down to E and not increase
",87,,,,,,,,,,,,,,,,,,,,,,,Stock 2 of 5:,3,,"I don't believe that the price will go down but go up, because you can see it on the chart
","I believe that the price will go down, because you can see it on the chart
",46,,,,,,,,,Stock 4 of 5:,4,,I think that in my perspective it will increase to C and not decrease,"I think from my perspective it will go down to E and not increase
",100,,,,,,,,,,,,,,,,,,,,,,,,,3,5d9b48ba2f1c6e030926fc28,ThinkDifferent,ItemConfidence
7/19/2023 9:17,7/19/2023 9:37,0,100,1189,1,7/19/2023 9:37,R_21A4Z95ZjKv4iD4,anonymous,EN,Stock 5 of 5:,2,"Analyzing the history, the stock should go up to the A space if it keeps the tendency. But once it suffers a lot of variation, I think it won't go that up, so I guess B zone i a good guess.",,,,26,33,22,8,7,3,1,0,,,,,,,,,,,,,,,Stock 4 of 5:,6,"Following the recent history, it is expected for the stock price to land somewhere between F and G. Once it may go up some weeks I think F zone is a good guess.",,,,0,2,6,10,21,33,24,4,,,,,,,,,,,,,,,Stock 1 of 5:,4,"Once the few last dots are showing the price had a decrease in valuation and now is stable, the prediction is for it to go up for the next months based on the tipical stocks history. Not that up to cross the C line, though. So I guess D is a good guess.",,,,2,6,23,36,21,9,3,0,,,,,,,,,,,,,,,,,,,,,,,,,,,,,,,,,,,,,,,,,,,Stock 3 of 5:,3,"Even though the price had a break down in the last weeks, I think the expected is for it to continuing going up landing on C space by 10 weeks from that day.",,,,1,11,26,23,22,9,6,2,Stock 2 of 5:,4,I think D is a good guess because I think it is probable that the stock price goes a bit down but by the next few weeks it come up to D space again.,,,,2,7,21,24,22,13,9,2,"It would be fun to know what really happened, so we could see if our predictions were good or bad.",The influence of recent stock prices on people's opinion on its future valuation.,3,602de6015bae508d87082490,ThinkMore,Histogram
7/19/2023 9:19,7/19/2023 9:43,0,100,1392,1,7/19/2023 9:43,R_qx8AEQasaBfMIuZ,anonymous,EN,Stock 4 of 5:,7,The majority of stocks is on G and it is highly possible for it to decrease from the top to the bottom because most of it is on G that's why it is highly possible for it to decrease ,,,,8,7,10,8,7,7,44,9,Stock 5 of 5:,5,The majority of stocks is on E and it is highly possible for it to decrease from the top approaching the E and incre lncrease from the bottom approaching the top of which is E,,,,1,2,4,5,42,23,13,10,,,,,,,,,,,,,,,Stock 3 of 5:,5,The stocks will land on E because the majority of stocks is lying on E and it will increase from the bottom approaching E and it will slightly decrease from the top to fill D part,,,,8,7,7,11,32,20,8,7,Stock 1 of 5:,5,The stock will land on E because the majority of dots are on E that it has higher chances the stocks will slightly decrease from the top and slightly increase from the bottom ,,,,2,2,4,23,58,4,3,4,,,,,,,,,,,,,,,,,,,,,,,,,,,,,,,,,,,,,,,,,,,Stock 2 of 5:,4,The stocks will land on D because the most is on D and they will increase from the bottom approaching D and the is nothing on the top of the chat,,,,3,2,8,73,4,3,4,3,,,,,,,,,,,,,,,,,2,612cc44439ccefbbd5d4b278,ThinkMore,Histogram
7/19/2023 9:17,7/19/2023 9:44,0,100,1646,1,7/19/2023 9:44,R_2fvq2SA054Irh1m,anonymous,EN,,,,,,,,,,,,,,,,,,,,,,,,,,,,,,,,,,,,,,,,,,,,,,,,,,,,,,,,,Stock 3 of 5:,5,this stoke trend shows a volatile movement with does not show a clear direction whether is a upward trend or downwards trend it would be best to wait for it to show direction ,,,,0,0,0,19,81,0,0,0,Stock 2 of 5:,3,the stock was on a downward trend now it is gaining momentum and more people are buying the shares so the demand is high ,,,,11,26,63,0,0,0,0,0,Stock 5 of 5:,6,"the stoke is on a downward trend because people are no longer buying the stoke or the economy  is going down 
",,,,0,0,0,0,10,90,0,0,Stock 1 of 5:,6,i think the will go done because it has been going on upward trend then there are high possibility that it might brake the trend ,,,,11,18,10,49,12,0,0,0,,,,,,,,,,,,,,,Stock 4 of 5:,5,the price will reach that lend in that bin because the demand has reached its top momentum so the trend will start going down ,,,,0,0,22,78,0,0,0,0,,,1,616dcea8c4e227d557d84166,ThinkMore,Histogram
7/19/2023 9:19,7/19/2023 9:45,0,100,1605,1,7/19/2023 9:45,R_XM0T6s7tgPtXKff,anonymous,EN,,,,,,,,,,,,,,,,,,,,,,,,,,,,,,,,,,,,,,,,,,,,,,,,,,,,,,,,,Stock 1 of 5:,6,The stock seem to have been falling in their last dots so I think it is going to keep on falling... Or dropping before it can start to rise since the drop was constant,,,93,,,,,,,,,Stock 3 of 5:,5,The stock seem to be staying in one lane which is E so the chances of it ever dropping any lower or higher are very low,,,91,,,,,,,,,Stock 5 of 5:,7,The stock seems to be falling very steeply so the likelihood of it being way down there is very high even all the way bottom down,,,67,,,,,,,,,Stock 4 of 5:,4,The rise of the stock seem to be very constant so it can rise steeply or fall steeply before the red line to that is why I choose D ,,,94,,,,,,,,,,,,,,,,,,,,,,,Stock 2 of 5:,5,The stock seem to be rising and falling at a constant rate so the stock the stock from the last dot was dropping and the likely hood of it rising before the red line seem a bit high ,,,53,,,,,,,,,,,1,60ee913de67c56daf5e842a9,ThinkMore,ItemConfidence
7/19/2023 9:17,7/19/2023 9:48,0,100,1847,1,7/19/2023 9:48,R_27fKEWk1JeBKuZO,anonymous,EN,Stock 3 of 5:,2,"The upward trend will continue for at least a short period of time before it stops. I think it still has a chance to continue rising, which is why I think it will position itself in B",,,,13,42,31,9,2,1,1,1,Stock 5 of 5:,3,"It shows constant growth which is good, it must have a firm base so I would think it can continue to grow until C",,,,6,9,72,7,3,1,1,1,Stock 1 of 5:,5,Because its tends to raise after a long period of falls. Normally in a normal scenario this will be how it would work,,,,1,1,1,7,80,6,3,1,Stock 2 of 5:,4,"Based on the above information, it is seen that prices are stable at least for a short period, for which prices should fluctuate between lines D and E and even reach line C.",,,,1,5,17,33,34,8,1,1,,,,,,,,,,,,,,,,,,,,,,,,,,,,,Stock 4 of 5:,6,"it had an abrupt drop so I think it will continue to drop for at least another period, normally it will tend to bottom out to go down and start a slow rise",,,,1,1,1,11,13,48,22,3,,,,,,,,,,,,,,,,,,,,,,,,,,,,,,,,,,,,,,,,,,,Nope,market trends,1,613ab15693299c16c27d8c92,ThinkMore,Histogram
7/19/2023 9:19,7/19/2023 9:49,0,100,1804,1,7/19/2023 9:49,R_XFVa3g6A2Z4P3wJ,anonymous,EN,,,,,,,,,,,,,,,Stock 1 of 5:,2,,"The trajectory of the commodity is upward, thus it makes sense that the price would be in region A in 10 weeks.","Although the commodity is generally trending upwards, markets are unpredictable as evidenced by the zig-zagging trend. In any case, after rallying, a commodity usually stabilises at some point which I predict would be within the range of C.",,21,40,19,10,7,3,0,0,,,,,,,,,,,,,,,,,,,,,,,,,,,,,Stock 4 of 5:,4,,"The commodity has already shown the potential of reaching C, and when it rallies upwards, it does so for a longer time than it goes downwards.","Bin E is the lowest at which the commodity has traded and it is the least expected on its performance, and thus a feasible position.",,0,0,19,58,23,0,0,0,Stock 2 of 5:,6,,The price is going up and down within a certain range.,"When the price of the commodity goes down, it does so for a longer time as compared to when it goes up.",,9,14,28,35,14,0,0,0,,,,,,,,,,,,,,,,,,,,,,,,,,,,,Stock 3 of 5:,1,,The price of the commodity is rallying upwards with little signs of going down.,Bin B could be the lowest where the commodity will end because its affinity for an upward trend is remarkably high. ,,39,40,16,5,0,0,0,0,Stock 5 of 5:,5,,The product is averaging bin D and one would expect it not to venture far from it.,"Since the product has once dropped as far as F, bin F is the lowest expected trade price for the product.",,0,0,24,61,15,0,0,0,,Predicting commodity price.,3,60a5404314ae1a9d5b88565d,ThinkDifferent,Histogram
7/19/2023 9:28,7/19/2023 9:53,0,100,1491,1,7/19/2023 9:53,R_bjsVvSfVBr5kn0l,anonymous,EN,,,,,,,,,,,,,,,,,,,,,,,,,,,,,Stock 1 of 5:,6,,The price will end at F in the next 8 weeks. The has been showing a downwards trend for weeks.  There is no information shared that will change this.,Stock prices changed all the time. Even when prices are dropping that can change at any moment.,37,,,,,,,,,,,,,,,,,,,,,,,Stock 5 of 5:,5,,We trust that it will be stable and not crash low.,Buy the stock at low prices and hope it grows again.,35,,,,,,,,,Stock 2 of 5:,3,,When the share price has been growing sturdy it is highly likely to continue growing with no hindering.,It's favorable stock to continue growing.  All the previous data shows.,35,,,,,,,,,Stock 3 of 5:,3,,It's unfortunate that it seems like it won't grow in the future.,It's the kind of stock you buy low and hold on to it till the price starts growing.,25,,,,,,,,,,,,,,,,,,,,,,,,,,,,,,,,,,,,,Stock 4 of 5:,4,,It looks like it's in a bear market face with very low growth.,Buy at low growth phase and sell when the market changes and more favorable.,36,,,,,,,,,Mire information on the company ,Stocks ,2,6090755b3aebf491674a5e86,ThinkDifferent,ItemConfidence
7/19/2023 9:18,7/19/2023 10:07,0,100,2939,1,7/19/2023 10:07,R_3oLo4LtEWKzRXbE,anonymous,EN,,,,,,,,,,,,,,,Stock 4 of 5:,4,,The stock price will eventually be reach after a short period of time as the price seem to be gaining momentum ,"The price will not go back to bin E, because the stock price above shows a momentum ",,0,0,10,83,7,0,0,0,,,,,,,,,,,,,,,Stock 3 of 5:,4,,"The stock price i think it is a bit impossible to reach bin C, as the price is moving at a ranging mode.",Bin E is likely to be reach but yet again not guaranteed as the price seems to have gained some momentum,,0,0,0,56,44,0,0,0,,,,,,,,,,,,,,,,,,,,,,,,,,,,,Stock 1 of 5:,5,," The bin D, will soon be reached again because the price in bin E show some momentum ","I did not choose the F bin, because I believe that the stock price will gain momentum and will not reach that bin",,0,0,0,95,0,0,0,5,Stock 5 of 5:,4,,"The price will reach bin C, but the stock price is currently moving at a ranging mode so it will be better to wait for a clear indication before choosing the right direction ","The price  will not by any chance reach Bin E, because the price might be moving sloppy but I showing an upward movement ",,0,0,0,71,29,0,0,0,,,,,,,,,,,,,,,Stock 2 of 5:,4,,"I did not choose Bin C, because the price seems to be moving slow and I don't think it will reach bin C any time soon ","Bin E, It is much likely to be reach as the price is closer to it.",,0,0,0,50,50,0,0,0,It was quite exciting ,I think it is evaluating the knowledge people have about the stock market ,1,611abd11be1e0949aa0a60d1,ThinkDifferent,Histogram
7/19/2023 10:01,7/19/2023 10:07,0,100,363,1,7/19/2023 10:07,R_1M5GojY92KgIQH4,anonymous,EN,,,,,,,,,,,,,,,Stock 4 of 5:,3,,Great growth is experienced and it will land in bin B,The peak has been reached and it will land in bin D,71,,,,,,,,,,,,,,,,,,,,,,,Stock 5 of 5:,4,,significant Fluctuations may lead to it landing in bin C,It is entering a downward spiral and will land in bin E,61,,,,,,,,,Stock 3 of 5:,5,,A bear market is being experienced therefore likely to land in bin D,It is on the decline and therefore it will land in bin F,70,,,,,,,,,,,,,,,,,,,,,,,,,,,,,,,,,,,,,Stock 1 of 5:,4,,It is currently following an upwards trend therefore it is likely to land in bin C.,It has reached its peak therefore it is likely to land in bin E. In a turnaround phase,74,,,,,,,,,Stock 2 of 5:,4,,The bear market has just started prices are increasing therefore it is likely to land in bin C,It is on a decline pahse as the peak has already been reached it is likely to land in bin E,57,,,,,,,,,,,,,,,,,,,,,,,,,3,610c39c4c8c39fd3b5a57488,ThinkDifferent,ItemConfidence
7/19/2023 9:16,7/19/2023 9:18,0,21,100,0,7/19/2023 10:18,R_21zaaeufepZFpVp,anonymous,EN,,,,,,,,,,,,,,,,,,,,,,,,,,,,,,,,,,,,,,,,,,,,,,,,,,,,,,,,,,,,,,,,,,,,,,,,,,,,,,,,,,,,,,,,,,,,,,,,,,,,,,,,,,,,,,,,,,,,,,,,,,,,,,,,,,,,,,,,,,,,,,,,,ThinkDifferent,ItemConfidence
7/19/2023 9:17,7/19/2023 9:18,0,21,40,0,7/19/2023 10:18,R_BxJaPQt90mLzmHD,anonymous,EN,,,,,,,,,,,,,,,,,,,,,,,,,,,,,,,,,,,,,,,,,,,,,,,,,,,,,,,,,,,,,,,,,,,,,,,,,,,,,,,,,,,,,,,,,,,,,,,,,,,,,,,,,,,,,,,,,,,,,,,,,,,,,,,,,,,,,,,,,,,,,,,,,ThinkDifferent,ItemConfidence
7/19/2023 9:18,7/19/2023 9:25,8,21,455,0,7/19/2023 10:25,R_1LFNe7WqqZvNLjC,anonymous,EN,,,,,,,,,,,,,,,,,,,,,,,,,,,,,,,,,,,,,,,,,,,,,,,,,,,,,,,,,,,,,,,,,,,,,,,,,,,,,,,,,,,,,,,,,,,,,,,,,,,,,,,,,,,,,,,,,,,,,,,,,,,,,,,,,,,,,,,,,,,,,,,,,ThinkMore,ItemConfidence
7/19/2023 10:23,7/19/2023 10:30,0,100,407,1,7/19/2023 10:30,R_Zy0updr97VjsNX3,anonymous,EN,Stock 4 of 5:,1,"We're on a serious winner here - look at that upward trajectory, pile in now! It's shown incredible promise so far.",,,,41,21,19,11,8,0,0,0,Stock 5 of 5:,3,We're making steady wins on this stock - every day finishing slightly higher than the last. I think we're set to see further improvement as the week progresses.,,,,9,20,29,22,12,6,2,0,Stock 1 of 5:,4,Thinks generally move up and down - I believe it'll go up back in line with the starting price. Eventually I'm sure it will exceed the start point but in the short timescale for now I think it will definitely go up.,,,,12,28,24,21,7,5,2,1,,,,,,,,,,,,,,,,,,,,,,,,,,,,,,,,,,,,,,,,,,,,,,,,,,,,,,,,,Stock 3 of 5:,4,"Looks like it's going to make a steady upward trajectory, slow and steady wins the race etc - I predict another week or two making small incremental increases.",,,,37,24,17,17,5,0,0,0,Stock 2 of 5:,1,"It looks to be on a steady incline - looking good for future development, I'd definitely place a bet on this one going up.",,,,39,23,12,16,10,0,0,0,,,,,,,,,,,,,,,,,3,54cc8b23fdf99b28036e2467,ThinkMore,Histogram
7/19/2023 10:23,7/19/2023 10:30,0,100,447,1,7/19/2023 10:30,R_ZwNPAUsOyEUS4JX,anonymous,EN,,,,,,,,,,,,,,,Stock 2 of 5:,3,"The trajectory is going upwards at a fairly consistent rate, so in 10 weeks time, it is quite likely and probable that it would come to rest in Bin C",,,,0,0,90,10,0,0,0,0,,,,,,,,,,,,,,,,,,,,,,,,,,,,,Stock 3 of 5:,5,"Seems to be coming down after rising initially, so if it continues along the same and expected path, then it is likely it will land in E",,,,0,0,0,10,80,10,0,0,,,,,,,,,,,,,,,Stock 4 of 5:,6,"Seems to be going in a downwards trajectory, so if it continues along this path, it will likely fall into bin F",,,,0,0,0,0,20,60,20,0,Stock 5 of 5:,4,"Rising t a fairly consistent and predictable rate, therefore I assume that it would follow the same path and fall into bin D",,,,0,0,10,90,0,0,0,0,Stock 1 of 5:,4,"The trajectory is going upwards at a fairly predictable rate, so if it follows the same sort of line it would finish at D",,,,0,0,10,81,9,0,0,0,,,,,,,,,,,,,,,Very interesting to complete - thank you!,If stocks are at all predictable?,1,5e2c8f69cad44b2bc5ce9a34,ThinkMore,Histogram
7/19/2023 10:23,7/19/2023 10:32,0,100,527,1,7/19/2023 10:32,R_3DbYrDdR4qmLjwR,anonymous,EN,,,,,,,,,,,,,,,,,,,,,,,,,,,,,Stock 1 of 5:,6,"Most likely it will end in F due to the reocurring pattern that it's falling, anything can happen but it will keep going down in value as it has the previous days, it can also stabilize in E before dipping intensily afterwards.",,,80,,,,,,,,,Stock 5 of 5:,4,"As it dips people tend to panic sell their stocks, this will cause the graphic to go upwards, the most likely outcome will be D, as it slowly grows at a steady pace when it does indeed grow.",,,60,,,,,,,,,Stock 2 of 5:,5,"It will most likely go up slightly for a couple weeks in D until it falls back down to E, as the pattern suggests, of course its stock so it depends heavily on what the company is doing at the time, but this is the reoccuring pattern.",,,70,,,,,,,,,,,,,,,,,,,,,,,,,,,,,,,,,,,,,Stock 4 of 5:,4,"It could be either C or D if we look at the pattern, it's clearly at a steady upwards the past weeks and unless the company does something absurd it will continue growing upwards, but I've went with D as it's the most possible.",,,85,,,,,,,,,,,,,,,,,,,,,,,Stock 3 of 5:,6,"The pattern we see is that it has already reached its peak before, and it has hit once again it's second peak and it's now dipping, it has dipped very hard before so as this is the pattern, I'm choosing F as that's what seems most logical.",,,60,,,,,,,,,"It was interesting, most definitely and fun.",How people predict stocks.,3,614775c6f329a9e5ab190e04,ThinkMore,ItemConfidence
7/19/2023 10:23,7/19/2023 10:32,0,100,558,1,7/19/2023 10:32,R_PULbh38GJfYWwI9,anonymous,EN,Stock 1 of 5:,3,"The price skyrocketed in the last few weeks and therefore I don't think that it will grow in the same rate. Quite a lot of investors might be willing to sell the stock, as they made the profit, so that's another argument against high growth. Therefore I think that the stock will stay in the C bins.",,,35,,,,,,,,,Stock 3 of 5:,3,"The stock price is growing rather quickly. It's very rapid and I don't think that the growth will last forever, as many investors will sell their papers. However, I still think that the trend will continue and the price will raise to the C bin. It's a strong stock and I don't see it falling quickly.",,,40,,,,,,,,,Stock 4 of 5:,6,"Stock price is falling in a steady manner. I think that the trend will continue, it's the most likely outcome. However, the price has already lost quite a lot of value, so I don't think that it will be quick. That's why I think the F bin is most probable.",,,35,,,,,,,,,Stock 5 of 5:,5,There is no clear trend in this stock. I think that it will continue to behave rather randomly. It won't grow or fall that much. That's why I chose the E bin.,,,30,,,,,,,,,,,,,,,,,,,,,,,,,,,,,,,,,,,,,,,,,,,,,,,,,,,,,,,,,,,,,,,,,,,,,,,,,,,,,,,Stock 2 of 5:,6,"If the trend continues, the stock price will somewhat fall and should be in the F bin. The stock price is in the downward trend, even though it varies over the weeks. I think that the trend will be continued, therefore the F bin.
",,,40,,,,,,,,,,How sure are people when analyzing the stock market?,3,5c067e6329abc0000199ae45,ThinkMore,ItemConfidence
7/19/2023 10:23,7/19/2023 10:33,0,100,557,1,7/19/2023 10:33,R_1BXw3IcFiaTOamr,anonymous,EN,Stock 4 of 5:,2,"Although a great performer, this exciting company's stock is set to balance out around the B range before re-evaluating itself and tapering off. ",,,69,,,,,,,,,,,,,,,,,,,,,,,Stock 2 of 5:,8,"based on the market evaluation of this company's stock, a dramatic downward trend is predicted to reposition this stock in the H range of evaluation",,,80,,,,,,,,,,,,,,,,,,,,,,,,,,,,,,,,,,,,,Stock 3 of 5:,4,"Based on this company's performance, it's predicted this stock value will level off in the high to mid D range before course correction and settling. ",,,80,,,,,,,,,,,,,,,,,,,,,,,Stock 1 of 5:,3,"The trend for this company's stock suggest an upward trend that would land in the lower C range or upper D range. For this particular market analysis, I believe there's a much higher probability it would land in the low C range, with a much smaller chance or reaching value in the high D range. ",,,70,,,,,,,,,Stock 5 of 5:,4,This stock is keen to settle down around the high to mid D range before being reassessed in the market. ,,,68,,,,,,,,,,,,,,,,,,,,,,,,,1,5f516d96bf6cde3b04b94b69,ThinkMore,ItemConfidence
7/19/2023 10:23,7/19/2023 10:33,0,100,593,1,7/19/2023 10:33,R_1DZmDXcCxtnZmU6,anonymous,EN,,,,,,,,,,,,,,,,,,,,,,,,,,,,,Stock 2 of 5:,6,"From the data that has been shown to us, I can use my own knowledge by looking at it that it is morelikely to decrease as there hasn't been no points where it has increased to a significant point.",,,100,,,,,,,,,Stock 5 of 5:,4,"You can see a pattern in the data, the dots kept going higher and higher. This clearly shows that there is no chance for it to go down hill.",,,50,,,,,,,,,Stock 4 of 5:,5,The reason behind why I have chosen E is because the data has reached a high point and it is very unlikely to see it increase a large amount.,,,62,,,,,,,,,,,,,,,,,,,,,,,,,,,,,,,,,,,,,Stock 3 of 5:,3,I have shown the letter C because it could likely go over the line as you can see the data the individual dots went over the line.,,,40,,,,,,,,,,,,,,,,,,,,,,,Stock 1 of 5:,4,"Well I expect it to rise to D, the reasoning behind this as you can see at the start it rose but then decreased but not so much when you carry on looking at the chart it suddenly decreased and then slightly increased. So my prediction is that it would decrease slightly and then moved back to D in the original position.",,,20,,,,,,,,,,,1,5693df018d93fe000dfa5733,ThinkMore,ItemConfidence
7/19/2023 10:27,7/19/2023 10:34,0,100,459,1,7/19/2023 10:34,R_3G6UYLksKCug9UW,anonymous,EN,Stock 5 of 5:,2,,Stock price is increasing fast so may be it will land in B as per the graph shown,Stock price is increasing fast so may be it will land in B as per the graph shown,,36,64,0,0,0,0,0,0,Stock 2 of 5:,3,,Stock price is increasing so may be it will land in C as per the graph shown,Stock price is increasing so may be it will land in C as per the graph shown,,11,26,57,6,0,0,0,0,,,,,,,,,,,,,,,Stock 4 of 5:,5,,Stock price is decreasing so may be it will land in E as per the graph shown,Stock price is decreasing so may be it will land in E as per the graph shown,,0,0,0,31,60,9,0,0,,,,,,,,,,,,,,,,,,,,,,,,,,,,,Stock 1 of 5:,4,,I think it will be somewhere in middle based on the graph shown.,I think it will be somewhere in middle based on the graph shown.,,2,1,7,57,21,9,2,1,Stock 3 of 5:,4,,Stock price is increasing slowly so may be it will land in D as per the graph shown,Stock price is increasing slowly so may be it will land in D as per the graph shown,,0,3,30,54,13,0,0,0,,,,,,,,,,,,,,,,,,,,,,,,,,,,,,,3,61365f766033bc62f92053dc,ThinkDifferent,Histogram
